Nimi,Valuutta,Tietoa,Rating,Riski,Vastuullisuus (SFDR),Omistajia Nordnetissä,Kulut,Kategoria,Yläluokka,Alakategoria
BNPP Rspnb US Mlt-Fac Eq Cl Acc,USD,"The implemented strategy aims at increasing the value of a portfolio of US equities, issued primarily by socially responsible companies, over the medium term using a systematic security selection approach combining several factor styles. At all times, this sub-fund invests at least 75% of its assets in equities and/or equity equivalent securities issued by companies that have their registered offices or conduct the majority of their business activities in the United States of America. The remaining portion, namely a maximum of 25% of its assets, may be invested in other equities, debt securities and money market instruments, provided that investments in debt securities of any kind do not exceed 15% of its assets, and up to 10% of its assets may be invested in UCITS or UCIs.",3 stars,4 / 7,8,82,"1,46%",Maantiede,Kehittyneet maat – suuret yhtiöt,Yhdysvallat suuret sekatyyli
Allianz US Equity Fund AT USD,USD,Long-term capital growth by investing in companies of US equity markets with a minimum market capitalisation of USD 500 million.,2 stars,4 / 7,6,166,"1,85%",Maantiede,Kehittyneet maat – suuret yhtiöt,Yhdysvallat suuret sekatyyli
Amundi Fds MA Consrv Rspnb A EUR C,EUR,"Seeks to increase the value of your investment over the recommended holding period, while investing in economic activities that contribute to a Sustainable Future, addressing some of the global challenges in order to achieve sustainable growth.",3 stars,3 / 7,8,40,"1,48%",Yhdistelmä,Varovainen,
FF - Global Consumer Brds A-Dis-EUR,EUR,"The fund aims to achieve capital growth over the long term. The fund invests at least 70% of its assets, in equities of companies from anywhere in the world, including emerging markets, and linked to the theme of consumer brands, such as companies with intellectual property, pricing power and a strong track record of growth. Investments will be made in companies involved in the designing, manufacturing, marketing and/or selling of branded consumer goods and/or services. The fund may also invest in money market instruments on an ancillary basis.",4 stars,4 / 7,8,305,"1,91%",Sektori,Kuluttajatuotteet & palvelut,
HSBC GIF ASEAN Equity AC,USD,"The sub-fund aims to provide long term total return by investing in a portfolio of ASEAN equities. The sub-fund invests in normal market conditions a minimum of 70% of its net assets in equities and equity equivalent securities of companies which are domiciled in, based in, carry out the larger part of their business activities in ASEAN countries, The sub-fund may also invest in eligible closed-ended Real Estate Investment Trusts (“REITs”). The sub-fund normally invests across a range of market capitalisations without any capitalisation restriction.",0 stars,4 / 7,8,99,"1,85%",Maantiede,Kehittyvät maat,ASEAN
Templeton Global Bond A(acc)EUR,EUR,"Rahasto sijoittaa ensisijaisesti salkkuun, joka koostuu valtioiden tai valtioihin sidoksissa olevien liikkeeseenlaskijoiden maailmanlaajuisesti liikkeeseen laskemista kiinteistä ja vaihtuvakorkoisista velkapapereista ja velkasitoumuksista. Rahasto voi myös, sijoitusrajoitukset huomioon ottaen, sijoittaa yritysten liikkeelle laskemiin velkakirjoihin sekä arvopapereihin tai strukturoituihin tuotteisiin, jotka liittyvät minkä tahansa valtion varoihin tai valuuttoihin. Rahasto voi myös ostaa useiden valtioiden organisoimien tai tukemien ylikansallisten elinten liikkeeseen laskemia velkasitoumuksia. Rahasto voi sijoittaa korkeintaan 10 % kokonaisnettovaroistaan maksuhäiriöisiin arvopapereihin ja korkeintaan 25 % kokonaisnettovaroistaan tiettyihin johdannaisinstrumentteihin.",1 star,3 / 7,8,54,"1,35%",Korko,Joustava,
HSBC GIF Global EM Local Dbt AC,USD,"The sub-fund invests for total return primarily in a diversified portfolio of Investment Grade and Non-Investment Grade rated bonds and other similar securities, as well as currency forwards and non-deliverable forwards (together “Instruments”). These Instruments are linked to the currency of securities issued or guaranteed by governments, government agencies, quasi-government entities, state sponsored enterprises, local or regional governments (including state, provincial, and municipal governments and governmental entities) or supranational bodies of Emerging Markets or companies which have their registered office in Emerging Markets and will be primarily denominated in local currency. On an ancillary basis, the sub-fund may consider investments in securities denominated in USD and those of other OECD countries.",2 stars,3 / 7,6,15,"1,60%",Korko,Kehittyvät maat,
Nordnet Småbolag Sverige Index,SEK,"Rahaston tavoitteena on seurata OMX Sweden Small Cap ESG Responsible Net Index (Bloomberg Ticker: OMXSSENI) -indeksin kehitystä palkkioiden ja kulujen vähentämisen jälkeen. Indeksi on osakeindeksi, joka seuraa OMX Stockholm Index -indeksiin listatun 80 likvideimmän pienen yhtiön osakkeita, joiden liikkeeseenlaskijat täyttävät ympäristöä, yhteiskuntaa ja hyvää hallintotapaa (”ESG”) koskevat kriteerit. Indeksi on vapaan vaihdannan markkina-arvoon painotettu indeksi. Liikkeeseenlaskijoiden valinta perustuu osakkeen suhteelliseen markkina-arvon suuruuteen ja arvopapereilla käydyn kaupan volyymiin. Rahastoa hallinnoivat yhdessä Nordnet Fonder AB ja J.P. Morgan Mansart Management Limited.",0 stars,4 / 7,8,10456,"0,35%",Maantiede,Kehittyneet maat – small/mid ja keskisuuret,Ruotsi small/mid
SEB Sverigefond Småbolag C/R,SEK,-,4 stars,5 / 7,8,2321,"1,50%",Maantiede,Kehittyneet maat – small/mid ja keskisuuret,Ruotsi small/mid
Templeton Global A(acc)USD,USD,Rahasto sijoittaa minkä tahansa maiden yritysten ja hallitusten osakesidonnaisiin arvopapereihin ja velkasitoumuksiin. Rahasto sijoittaa ensisijaisesti kantaosakkeisiin.,1 star,4 / 7,8,66,"1,81%",Maantiede,Maailma,Maailma suuret sekatyyli
DNB Fund Renewable Energy A EUR Acc,EUR,"The sub-fund seeks to invest in equities contributing to a better environment, by investing in companies whose services and technologies help reduce global Green House Gas (GHG) emissions, as well as to achieve a positive relative return over the long-term, principally through investments in equities of small, medium and large capitalization size companies globally.",3 stars,5 / 7,9,754,"1,56%",Sektori,Uusiutuva energia,
Schroder ISF EURO Govt Bd A Dis EUR AV,EUR,"To provide a combination of high yield and medium term capital growth, through the exploitation of specific opportunities presented by the bond markets of Europe. The Fund will invest in a diversified portfolio of European Government or supranational bond issues and, where appropriate, in such issues in the relevant European market, including those dominated in Euro, and corporate issues.",2 stars,3 / 7,8,919,"0,59%",Korko,Pitkä korko / Valtio,
Handelsbanken Pohjoismaat Sel (A1 EUR),EUR,"Rahasto on aktiivisesti hoidettu osakerahasto, joka keskittää sijoituksensa pienempään määrään yhtiöitä. Rahaston tavoitteena on tuottaa hyvin pitkällä aikavälillä sijoittamalla pitkäjänteisesti pohjoismaiselle osakemarkkinoille. Rahasto tekee pitkäaikaisia sijoituksia 16-25 pohjoismaiseen yritykseen. Sijoituskohteiksi valitaan yrityksiä, joilla on historiallisesti ollut vakaa tuloskehitys, taseet vahvassa kunnossa, liiketoiminta terveellä pohjalla ja osingot tasaisessa kasvussa. Johdannaisia voidaan käyttää sijoitustavoitteiden saavuttamiseksi sekä salkunhoidon tehostamiseksi.",4 stars,4 / 7,8,367,"1,85%",Maantiede,Kehittyneet maat – small/mid ja keskisuuret,Pohjoismaat
BMC Global Select R EUR,EUR,"BMC Global Select is an actively managed equity fund with a global focus. The fund's objective is to create a high positive return over time for the unit holders, with a balanced equity risk. The investment strategy focuses on finding around 30 companies of very high quality, the fund's Champions, with good future prospects and an attractive valuation. An important part of the work to find the best companies is to visit companies and meet the management and other company representatives. More information is available at bmcapital.se.",4 stars,4 / 7,8,434,"1,55%",Tyyli,kasvuosakkeet,
BGF European A2,EUR,Rahasto sijoittaa pääsääntöisesti eurooppalaisiin pörssiosakkeisiin. Osa sijoituksista voidaan tehdä Itä-Euroopan kehittyville markkinoille.,3 stars,4 / 7,8,221,"1,82%",Tyyli,kasvuosakkeet,
Evli Valtionobligaatio B,EUR,"Evli Euro Valtionobligaatio on Suomessa rekisteröity pitkän koron rahasto, joka sijoittaa varansa luottokelpoisuudeltaan ensiluokkaisiin euroalueen valtioiden pitkiin korkoinstrumentteihin.",3 stars,3 / 7,6,564,"0,66%",Korko,Pitkä korko / Valtio,
CT European Real Estate Scs A Acc EUR,EUR,The investment objective of the Fund is to generate a total return greater than that produced by the FTSE EPRA/NAREIT Developed Europe Capped Index (Net) in Sterling (the “Index”). The Index is a free float-adjusted market capitalisation weighted index that is designed to represent general trends in eligible real estate equities in developed Europe by reflecting the stock performance of companies engaged in real estate activities in developed Europe.,3 stars,5 / 7,6,150,"2,62%",Kiinteistö,,
Allianz Europe Small Cap Equity AT EUR,EUR,The fund seeks long-term capital growth by investing in European Equity Markets with a focus on small sized companies.,2 stars,4 / 7,8,75,"2,10%",Maantiede,Kehittyneet maat – small/mid ja keskisuuret,Eurooppa pienyhtiöt
Amundi MSCI EurSRIClmtPrsAlgd AE C,EUR,"To track the performance of MSCI Europe SRI Filtered PAB Index (""the Index""), and to minimize the tracking error between the net asset value of the sub-fund and the performance of the Index. MSCI Europe SRI Filtered PAB Index is an equity index based on the MSCI Europe index representative of the large and mid-cap stocks across 15 developed market countries in Europe (as of November 2021) (the ""Parent Index"").",2 stars,4 / 7,8,761,"0,35%",Maantiede,Kehittyneet maat – suuret yhtiöt,Eurooppa suuret sekatyyli
Swedbank Robur Small Cap Global A,SEK,"Small Cap Global is an actively managed equity fund that mainly invests in small and medium-sized companies across a range of sectors worldwide. The fund invests in companies with a market capitalisation no greater than the largest company in the fund´s benchmark index by the time of investment. The fund´s investment strategy focuses on selecting companies, where sector, region and theme analyses are important components in the strategy. The fund is managemend with a long-term investment horizon and selects the companies we find attractively valued in relation to our view of the company's future earnings potential. The fund complies with Swedbank Robur’s Responsible Investment Policy. Read more about the policy in the fund’s Information Brochure and swedbankrobur.se. Sustainability and climate work is an integrated part in our investment strategy. The fund is suitable for those who want to invest globally and believe in the growth opportunities in smaller companies.",2 stars,4 / 7,8,575,"1,25%",Maantiede,Maailma,Maailma small/mid
SEB Sverigefond Småbolag,SEK,-,4 stars,5 / 7,8,1128,"1,50%",Maantiede,Kehittyneet maat – small/mid ja keskisuuret,Ruotsi small/mid
Nordea 1 - Global Listed Infrastr BP EUR,EUR,"The strategy invests globally and a minimum of three-fourths of its total assets (excluding cash) in equity related securities issued by infrastructure companies listed or traded on a regulated market. The Strategy seeks to generate meaningful outperformance versus the global infrastructure securities market utilizing top-down sector allocation along with stock selection through fundamental market research and analysis. In actively managing the fund?s portfolio, the management team combines region and sector allocation with fundamental company research to select companies that appear to offer superior growth prospects and investment characteristics.",2 stars,4 / 7,8,96,"1,94%",Sektori,Infrastruktuuri,
Templeton Frontier Markets A(acc)USD,USD,The Fund’s principal investment objective is to provide long-term capital appreciation.,2 stars,3 / 7,6,168,"2,58%",Maantiede,Maailma,Frontier-markkinat
Swedbank Robur Global Trends A,SEK,"Global Trends on aktiivisesti hallinnoitava osakerahasto, joka sijoittaa pääasiassa maailmanlaajuisesti eri alojen yrityksiin, jotka tuotteidensa, palvelujensa tai toimintansa ansiosta myötävaikuttavat Swedbank Roburin harkinnan mukaan kestävästi kehittyvään yhteiskuntaan. Rahaston hallinto on temaattista ja lähtee väestörakenteesta ja terveydestä, tekniikasta ja innovaatiosta, turvallisuudesta ja geopolitiikasta sekä ilmastosta ja luonnonvaroista. Rahastolla on pitkän aikavälin sijoitushorisontti ja aktiivinen sijoitusstrategia, joka keskittyy yritysten valintaan, jossa myös sektorin ja alueen analyysi ovat tärkeitä strategian osatekijöitä. Rahasto noudattaa Swedbank Roburin vastuullisen sijoittamisen politiikkaa ja välttää kupliin sijoittamista. Lue lisää rahaston avaintietoasiakirjasta ja sivustolta swedbankrobur.se. Kestävä kehitys ja ilmastoasiat ovat sijoitusstrategian olennaisia osia. Rahastossa on useita osakeluokkia, lue lisää rahaston avaintietoasiakirjasta.",4 stars,4 / 7,8,1336,"1,25%",Tyyli,kasvuosakkeet,
UBS (Lux) BS Global Dyn $ P-acc,USD,"This sub-fund promotes environmental and/or social characteristics. The sub-fund seeks to achieve attractive returns by investing in the global bond markets while managing the overall portfolio risk. This sub-fund is actively managed, without reference to a benchmark. It seeks to spread capital across strategies that offer the best opportunities at any given time and on any given market or sector.",3 stars,2 / 7,8,26,"1,50%",Korko,Joustava,
BGF US Basic Value A2,USD,"US Basic Value Fund -rahasto pyrkii maksimoimaan Yhdysvaltain dollareissa esitetyn pääoman arvonnousun ja toiseksi tuoton sijoittamalla ensisijaisesti Yhdysvalloissa sijaitsevien liikkeeseenlaskijoiden osakkeisiin, jotka ovat alinoteerattuja ja joilla on siksi perussijoitusarvoa. Rahasto painottaa arvopapereita, joita myydään alihintaan suhteessa niiden p/b-, p/c- tai p/e-lukuun tai jotka tuottavat keskitasoa suuremman osingon. Rahasto sijoittaa ainakin kaksi kolmasosaa nettovaroistaan Yhdysvalloissa sijaitsevien tai ensijaisesti toimivien liikkeeseenlaskijoiden siirtokelpoisiin arvopapereihin.",3 stars,4 / 7,6,102,"1,80%",Tyyli,arvoyhtiöt,
SEB Euro Bond Fund C B-Class FIN (EUR),EUR,"Tämä aktiivisesti hallinnoitu rahasto pyrkii kasvattamaan rahastosijoituksen arvoa ajan myötä ja ylittämään vertailuindeksin tuoton. Rahasto sijoittaa pääosin sijoituskelpoisiksi luokiteltuihin eurooppalaisten valtioiden joukkovelkakirjoihin. Sijoitustiimi hyödyntää makrotalouden, markkinoiden ja yksittäisten liikkeeseenlaskijoiden analyysiä, mukaan lukien kestävyysteemat aina, kun se on mahdollista, ja valitsee tältä pohjalta arvopapereita, jotka näyttävät tarjoavan suotuisaa riskisopeutettua tuottoa.",2 stars,3 / 7,6,415,"0,50%",Korko,Pitkä korko / Valtio,
ODIN Small Cap C EUR,EUR,The investment objective of the fund is to invest in small and medium-sized companies based in the Nordic region with an emphasis on Sweden.,3 stars,5 / 7,8,39,"1,50%",Maantiede,Kehittyneet maat – small/mid ja keskisuuret,Ruotsi small/mid
S-Pankki Euro Valtionlaina Korko A,EUR,"Rahaston varat sijoitetaan hajautetusti OECD:n jäsenvaltioiden, näiden osavaltioiden ja muiden paikallisten tai kansainvälisten julkisyhteisöjen liikkeeseenlaskemiin euromääräisiin korkoa tuottaviin arvopapereihin, kuten joukkolainoihin ja velkasitoumuksiin. Rahaston sijoitustoiminnan tavoitteena on aktiivisella rahastonhoidolla saada sijoitetuille varoille mahdollisimman hyvä keskipitkän aikavälin tuotto.",2 stars,3 / 7,6,6805,"0,50%",Korko,Pitkä korko / Valtio,
Danske Invest Glb Infl Lkd Bd A,EUR,Rahasto sijoittaa pääosin inflaatioon sidottuihin joukkolainoihin.,4 stars,3 / 7,8,11,"1,07%",Korko,Inflaatiosuojattu,
Lynx Active Balanced Fund D1 EUR,EUR,"The objective of the Fund is to achieve a long term capital appreciation to a moderate risk level by providing dynamic long exposure to a diversified range of asset classes and financial instruments. The Fund is actively managed and invests in a wide variety of global markets and asset classes consisting of equity indices, fixed income, foregin exchange and eligible diversified commodity indices. The Fund uses quantitative models for asset allocation and portfolio construction purposes.",2 stars,4 / 7,6,14,"1,70%",Yhdistelmä,Joustava,
JPM Climate Change Solu A (acc) - USD,USD,To achieve a return through investing in companies with exposure to the theme of climate change solutions.,3 stars,4 / 7,9,452,"1,30%",Sektori,Ympäristö,
Fidelity Asian High Yield A-Acc-EUR,EUR,"The fund aims to achieve capital growth over time and provide a high level of income. The fund invests at least 70% of its assets, in high-yielding below investment grade debt securities of issuers, or in high-yielding debt securities of below investment grade issuers, that do most of their business in the Asian region, including emerging markets.",3 stars,3 / 7,6,133,"1,40%",Korko,High Yield,
UBS (Lux) ES Global Hi Div $ P-acc,USD,"UBS Asset Management categorises this sub-fund as a Sustainability Focus Fund. This sub-fund promotes environmental and/or social characteristics and complies with Article 8 of Regulation (EU) 2019/2088 on sustainability-related disclosures in the financial services sector (“SFDR”). This actively managed sub-fund invests worldwide following the principle of risk diversification, with at least two thirds of its assets invested in equities or other equity interests of small, medium and large-cap companies in both developed and emerging markets. The Fund strategy is to select companies with high, consistent dividends. As the sub-fund invests in many foreign currencies due to its global orientation, the portfolio or parts thereof may be hedged against the reference currency of the sub-fund in order to reduce the associated foreign currency risks.",3 stars,3 / 7,8,536,"1,60%",Tyyli,osinko-osakkeet,
JPM ASEAN Equity A (acc) EUR,EUR,To provide long-term capital growth by investing primarily in companies of countries which are members of the Association of South East Asian Nations (ASEAN).,4 stars,4 / 7,8,14,"1,80%",Maantiede,Kehittyvät maat,ASEAN
M&G (Lux) Glb Dividend A USD Acc,USD,The Fund has two aims: to deliver a higher total return (capital growth plus income) than that of the global equities markets over any five-year period while applying ESG Criteria and to deliver an income stream that increases every year in US Dollar terms.,3 stars,4 / 7,8,88,"1,92%",Tyyli,osinko-osakkeet,
DNB Fund Nordic Equities A EUR Acc,EUR,"Osakerahasto, joka sijoittaa Ruotsiin, Suomeen, Tanskaan ja Norjaan.",3 stars,4 / 7,8,95,"1,47%",Maantiede,Kehittyneet maat – small/mid ja keskisuuret,Pohjoismaat
Nordea 1 - Nordic Equity BP EUR,EUR,"The Sub-fund will primarily invest in shares, convertible bonds and accessorily in warrants officially listed on a stock ex-change in Denmark, Norway, Sweden, Finland or Iceland. A maximum of 15 per cent of the Sub-fund´s net assets may be invested in securities officially listed on a stock exchange outside the Nordic region. The fund is invested according to a thematic approach, whereby the fund manager identifies broader themes that are likely to drive cash flows in a foreseeable future. Companies are then selected which are expected to capitalise on these themes.",3 stars,4 / 7,8,178,"1,81%",Maantiede,Kehittyneet maat – small/mid ja keskisuuret,Pohjoismaat
Invesco Emerging Markets Bond A USD SD,USD,"The Fund aims to achieve a high level of income together with long term capital growth. The Fund seeks to achieve its objective by investing primarily, through systematic beta management and alpha generative approaches, in debt securities of issuers in emerging market countries, which may be listed or traded elsewhere.",2 stars,3 / 7,8,147,"1,30%",Korko,Kehittyvät maat,
JPM Global Focus A (acc) EUR,EUR,The objective of the fund is to provide superior long-term capital growth by investing primarily in companies based throughout the world and that are deemed to be in recovery situations.,4 stars,4 / 7,8,707,"1,70%",Maantiede,Maailma,Maailma suuret sekatyyli
Danske Invest Global Sust Future A,EUR,"Rahasto tavoittelee markkinoiden yleisen kehityksen ylittävää tuottoa ja myötävaikuttaa osaltaan yhden tai useamman YK:n kestävän kehityksen tavoitteen (SDG, Sustainable Development Goals) saavuttamisessa. Osuuslajin osuudet ovat kasvuosuuksia. Rahasto sijoittaa maailmanlaajuisesti osakkeisiin, joiden liikkeeseenlaskijoiden odotetaan myötävaikuttavan tai hyötyvän kestävästä kehityksestä ja kiertotalouteen siirtymisestä.",3 stars,4 / 7,9,1653,"1,87%",Maantiede,Maailma,Maailma suuret sekatyyli
Arctic Global Select A NOK,"NOK","The investment objective is to achieve long-term capital appreciation, primarily through investments in a diversified portfolio of equity-focused Regulated Funds. There can be no assurance that the Fund will achieve its investment objective.",0 stars,4 / 7,8,197,"1,10%",Maantiede,Maailma,
Fidelity US Smaller Companies A-Acc-USD,USD,"The fund aims to achieve capital growth overthe long term. The fund invests at least 70% of its assets in equities of small companies that are listed, headquartered, or do most of their business in the United States. In actively managing the fund, the Investment Manager considers growth and valuation metrics, company financials, return on capital, cash flows and other measures, as well as company management, industry economic conditions, and other factors and does not integrate Sustainability Risks in its investment process.",0 stars,5 / 7,6,5,"1,95%",Maantiede,Kehittyneet maat – small/mid ja keskisuuret,Yhdysvallat pienyhtiöt
Invesco Sustainable Allc A Acc USD Hdg,USD,"The Fund aims to achieve a positive total return over a market cycle. The Fund seeks to achieve its objective by gaining exposure primarily to a flexible allocation of equities and debt securities globally, which meet the Fund’s environmental, social and governance (ESG) criteria with a particular focus on environmental issues. The Fund’s ESG criteria will be based on a set of screening thresholds (as outlined below and more fully described in the Fund’s sustainability-related disclosures) determined by the Investment Manager from time to time. These criteria will be reviewed and applied on an ongoing basis and integrated as part of the quantitative investment process for stock and bond selection as well as portfolio construction.",3 stars,3 / 7,8,73,"1,18%",Yhdistelmä,Maltillinen,
S-Pankki Suomalaiset Pienyhtiöt Osake A,EUR,"Rahasto sijoittaa varansa pääasiassa pienten tai keskisuurien suomalaisten tai sellaisten yhtiöiden, joille Suomi on rahastoyhtiön arvion mukaan keskeinen markkina-alue, osakkeisiin tai osakesidonnaisiin arvopapereihin. Rahaston sijoitustoiminnassa voidaan käyttää myös johdannaisia. Rahaston sijoitustoiminnan tavoitteena on aktiivisella rahastonhoidolla saada sijoitetuille varoille mahdollisimman hyvä pitkän aikavälin tuotto, joka ylittää vertailuindeksin tuoton.",0 stars,4 / 7,8,1 822,"1,80%",Maantiede,Kehittyneet maat – small/mid ja keskisuuret,Suomi
S-Pankki Suomalaiset Pienyhtiöt Osake G,SEK,"Rahasto sijoittaa varansa pääasiassa pienten tai keskisuurien suomalaisten tai sellaisten yhtiöiden, joille Suomi on rahastoyhtiön arvion mukaan keskeinen markkina-alue, osakkeisiin tai osakesidonnaisiin arvopapereihin. Rahaston sijoitustoiminnassa voidaan käyttää myös johdannaisia. Rahaston sijoitustoiminnan tavoitteena on aktiivisella rahastonhoidolla saada sijoitetuille varoille mahdollisimman hyvä pitkän aikavälin tuotto, joka ylittää vertailuindeksin tuoton.",0 stars,4 / 7,8,86,"1,80%",Maantiede,Kehittyneet maat – small/mid ja keskisuuret,Suomi
SEB European Defence & Security Fund C,EUR,"Fonden är aktivt förvaltad och investerar främst i aktier på den europeiska marknaden i bolag inom försvars- och säkerhetssektorn. Fonden har även möjlighet att investera upp till 25% utanför Europa, i medlemsländer i NATO och/eller OECD samt Taiwan. Fonden fokuserar på bolag som bedöms bidra till att stärka Europas försvarsförmåga, säkerhet och geopolitiska oberoende. Detta omfattar branscher som försvarsindustri, rymdteknik, cybersäkerhet, infrastruktur och råvaror. Även teknologier som är avgörande för samhällens motståndskraft, självförsörjning, resursoberoende, energiomställning, digitalisering och elektrifiering ingår. Investeringsbesluten baseras på ingående (fundamental) analys.",0 stars,4 / 7,8,169,"1,50%",Sektori,Teollisuusmateriaalit,
SEB Läkemedelsfond C,EUR,-,0 stars,0 / 7,8,302,"1,50%",Sektori,Terveydenhuolto,
SEB Läkemedelsfond D,EUR,-,0 stars,0 / 7,8,685,"1,50%",Sektori,Terveydenhuolto,
SEB Läkemedelsfond E,USD,-,0 stars,0 / 7,8,317,"1,50%",Sektori,Terveydenhuolto,
