Nimi,Valuutta,Tietoa,Rating,Riski,Vastuullisuus (SFDR),Omistajia Nordnetissä,Kulut,Kategoria,Yläluokka,Alakategoria
CT (Lux) Rspnb Glb Em Mkts Eq A Inc USD,USD,"The purpose of the Portfolio is to provide a medium through which investors may participate in an actively managed portfolio, primarily invested in equity and equity-related securities of companies in emerging markets worldwide. The Portfolio may, as described below, invest in companies which are listed or traded on a recognised exchange in emerging market countries worldwide, which have, in the opinion of the Investment Manager, the potential for generating long term returns and contribute to or benefit from the sustainable economic development of the emerging market countries. The subscription proceeds relating to the different Classes of Shares in issue shall be invested in one common underlying portfolio of investments. Each Class of Shares will have a proportional entitlement to the assets (and liabilities) of the Portfolio (calculated according to the prevailing Net Asset Values of each Class).",3 stars,5 / 7,8,2185,"1,82%",Maantiede,Kehittyvät maat,Kehittyvät maat
Handelsbanken Japan Tema (A1 EUR),EUR,"Sijoitusrahasto Handelsbanken Japani on aktiivisesti hoidettu osakerahasto, joka sijoittaa ensisijaisesti Japanilaisten yritysten pörssinoteerattuihin osakkeisiin. Tavoitteena on ylittää Japanin osakemarkkinoiden keskimääräinen tuotto pitkällä tähtäimellä. Rahasto voi sijoittaa myös japanilaisiin yrityksiin sijoittaviin rahasto-osuuksiin sekä enintään 10% varoista luottoinstituuttien tileille. Salkunhoitoa tehostaakseen rahasto voi käyttää myös johdannaisia, kuten esimerkiksi OTC-johdannaisia. Johdannaissijoitukset eivät vaikuta rahaston riskiin. Rahaston vertailuindeksinä toimii MSCI Japan.",3 stars,5 / 7,8,211,"1,60%",Tyyli,kasvuosakkeet,
Amundi MSCI EmMktsSRIClmtPrsAlgd AE C,EUR,"To track the performance of MSCI EM (Emerging Markets) SRI Filtered PAB Index (""the Index""), and to minimize the tracking error between the net asset value of the sub-fund and the performance of the Index.",2 stars,4 / 7,8,392,"0,51%",Maantiede,Kehittyvät maat,Kehittyvät maat
UBS (Lux) ES Enga for Imp(USD)EUR H PAcc,EUR,This actively managed sub-fund invests at least 90% of its net assets in equities and other equity interests of companies in developed and emerging markets worldwide that promote specific United Nations Sustainable Development Goals (UN SDGs). The sub-fund aims to provide capital appreciation and a positive environmental and/or social impact by investing in and engaging with attractively valued companies that offer products or services that are aligned to specific UN SDGs and present the potential for further impact by active engagement.,0 stars,4 / 7,8,44,"1,60%",Muut,,
Storebrand Japan A EUR,EUR,"Storebrand Japan on indeksiä lähellä oleva vastuullinen osakerahasto, joka sijoittaa laajasti osakkeisiin eri toimialoilla Japanin osakemarkkinoilla. Rahasto sijoittaa yleensä noin 180-250 yritykseen, jotka toimivat monilla eri toimialoilla. Rahasto noudattaa vastuullisen sijoittamisen periaatteitamme. Niiden mukaisesti emme sijoita muun muassa yrityksiin, jotka rikkovat kansainvälisiä sääntöjä ja sopimuksia. Nämä koskevat ihmisoikeuksia, työlainsäädäntöä ja kansainvälistä oikeutta, korruptiota, talousrikollisuutta, vakavia ilmasto- ja ympäristövahinkoja ja kiistanalaisia aseita (maamiinat, rypälepommit ja ydinaseet). Suljemme pois myös yritykset, joiden liikevaihdosta yli 5 % tulee tupakkatuotteiden, aseiden, alkoholin, uhkapelien, pornografian, kannabistuotteiden ja fossiilisten polttoaineiden valmistamisesta ja/tai jakelusta, sekä yritykset, joilla on suuret fossiilisten polttoaineiden varannot.",3 stars,4 / 7,8,8201,"0,21%",Maantiede,Kehittyneet maat – suuret yhtiöt,Japani suuret yhdistelmä
Nordea 1 - Asia ex Japan Eq Fd BP EUR,EUR,"Nordea1, SICAV – Asian Focus Equity Fund on Luxemburgiin rekisteröity kansainvälinen osakerahasto. Rahaston tavoitteena on säilyttää sijoittajan pääoma ja tarjota sijoitukselle riittävä tuotto. Vähintään 2/3 rahaston nettovaroista sijoitetaan Kaukoitään rekisteröityjen tai siellä liiketoimintaa pääasiassa harjoittavien yhtiöiden osakkeisiin. Tässä yhteydessä Kaukoitään kuuluvat Hongkong, Taiwan, Kiina, Etelä-Korea, Filippiinit, Indonesia, Malesia, Singapore, Thaimaa ja Vietnam. Enintään 1/3 rahaston nettovaroista voidaan pitää käteisenä tai sijoittaa muihin arvopapereihin, kuten muissa maissa toimivien yhtiöiden osakkeisiin, joukkolainoihin ja muihin velkasitoumuksiin. Sijoittajalla on oltava riittävät tiedot rahastosijoittamisesta ja rahastosta ymmärtääkseen, miten rahasto sopii hänelle. Sijoittajan tulee perehtyä virallisessa rahastoesitteessä ja avaintietoesitteessä mainittuihin, rahaston ja rahastosijoittamisen ominaisuuksiin ja riskeihin, sekä ymmärtää ja hyväksyä ne.",4 stars,4 / 7,8,183,"1,83%",Maantiede,Aasia ei-Japani / Aasia-Tyynimeri,Aasia ei-Japani
Spiltan Aktiefond Investmentbolag,SEK,-,3 stars,4 / 7,8,58418,"0,20%",Sektori,Rahoituspalvelut,
Nordnet Sverige Index,SEK,"Rahasto on Ruotsin markkinoille sijoittava osakeindeksirahasto, ja rahaston tavoitteena on jäljitellä OMX Stockholm Benchmark ESG Responsible Gross -indeksiä, joka sisältää vain tietyt kestävän kehityksen kriteerit täyttävät yritykset.",4 stars,4 / 7,8,205354,"0,00%",Maantiede,Kehittyneet maat – small/mid ja keskisuuret,Ruotsi
HSBC GIF BRIC Equity M2C,USD,"The sub-fund aims to provide long term total return by investing in a portfolio of equities from Brazil, Russia, India and China (including Hong Kong SAR) (“BRIC”). The sub-fund invests in normal market conditions a minimum of 90% of its net assets in equities and equity equivalent securities of companies which are domiciled in, based in, or carry out the larger part of their business activities in Brazil, Russia, India and/or China (including Hong Kong SAR) (BRIC). Investments in Chinese equities include, but are not limited to, China A-shares and China B-shares (and such other securities as may be available) listed on stock exchanges in the People's Republic of China (“PRC”). The sub-fund may directly invest in China A-shares through the Shanghai-Hong Kong Stock Connect and/or the Shenzhen-Hong Kong Stock Connect, subject to applicable quota limitations.",0 stars,5 / 7,6,162,"1,35%",Muut,,
Allspring (Lux) WW EM Eq Advtg AUSD Acc,USD,The Sub-Fund seeks long-term capital appreciation and current income. It is a high-risk vehicle that may be suitable for investors who are seeking long-term capital appreciation and current income offered through investment in equities and who are prepared to experience higher levels of volatility in pursuit of higher returns. The Sub-Fund promotes environmental and/or social characteristics but does not have a sustainable investment objective.,3 stars,4 / 7,8,18,"1,90%",Maantiede,Kehittyvät maat,Kehittyvät maat
DNB Fund Brighter Future A USD Acc,USD,"Fonden investerar i världens tillväxtmarknader såsom Fjärran Öster, Latinamerika och Östeuropa.",2 stars,4 / 7,8,29,"1,69%",Maantiede,Kehittyvät maat,Kehittyvät maat
Allianz Global Equity Insights AT EUR,EUR,Long-term capital growth by investing in global equity markets to achieve a concentrated equity portfolio with a focus on selection in accordance with E/S characteristics.,3 stars,4 / 7,8,223,"2,10%",Maantiede,Maailma,
PineBridge Asia ex Japan Equity A,USD,"The Sub-Fund seeks long-term capital appreciation by investing in the equity and equity-related securities of companies whose assets, products or operations are in the Asian Region. The Sub-Fund may also, to a lesser extent, invest in equity and equity-related securities of companies whose assets, products or operations are in Australia and New Zealand.",1 star,5 / 7,8,25,"2,03%",Maantiede,Aasia ei-Japani / Aasia-Tyynimeri,Aasia ei-Japani
Fidelity Global Technology A-Dis-EUR,EUR,"Rahasto pyrkii tarjoamaan sijoittajille pitkän aikavälin pääoman arvonnousua sijoittamalla maailmanlaajuisesti ensisijaisesti sellaisten yritysten osakkeisiin jotka ovat kehittäneet tai kehittämässä tuotteita, prosesseja tai palveluita, jotka hyötyvät merkittävästi teknologian edistymisestä ja kehittymisestä.",4 stars,4 / 7,8,6527,"1,89%",Sektori,Teknologia,
BNP Paribas Em Bd Opps Cl RH Eur C,EUR,The investment objective of the fund is to increase the value of its assets over the medium term by investing primarily in emerging bonds.,2 stars,3 / 7,8,21,"1,66%",Korko,Pitkä korko / Valtio,
Fondita Nordic Micro Cap B,EUR,"Fondita Nordic Micro Cap Sijoitusrahasto on osakerahasto, joka sijoittaa varansa ensisijaisesti pienten pohjoismaisten julkisesti noteerattujen yhtiöiden osakkeisiin. Pienillä yrityksillä tarkoitetaan yrityksiä, joiden pörssiarvo on enintään 800 miljoonaa euroa.",2 stars,4 / 7,8,104,"2,00%",Maantiede,Kehittyneet maat – small/mid ja keskisuuret,Pohjoismaat small/mid
Templeton Asian Growth A(acc)USD,USD,"Rahasto sijoittaa ensisijaisesti sellaisten liikkeeseenlaskijoiden osakesidonnaisiin arvopapereihin, joiden toimipaikka tai pääasiallinen liiketoiminta on ensisijaisesti Aasian alueella. Rahasto voi myös sijoittaa osakesidonnaisiin arvopapereihin, jotka noteerataan Aasian alueen pääomamarkkinoilla toimivissa hyväksytyissä arvopaperipörsseissä (Australiaa, Uutta-Seelantia ja Japania lukuun ottamatta).",2 stars,4 / 7,8,219,"2,16%",Maantiede,Aasia ei-Japani / Aasia-Tyynimeri,Aasia ei-Japani
UBS (Lux) EF Japan (JPY) P,JPY,"Rahasto sijoittaa pääasiassa suurimpiin japanilaisiin yrityksiin. Yritysten suhteellisen painotuksen määrittäminen perustuu mm. seuraaviin laatukriteereihin: yrityksen strategia, vahva markkina-asema, korkealaatuinen johtaminen, vakaa tuotto, kasvupotentiaali sekä omistaja-arvon (shareholder value) nostaminen. Hajautus saadaan aikaan ottamalla mukaan useita maita ja eri toimialoja ja tästä syystä rahasto tarjoaa sijoittajalle parhaan mahdollisen riski/tuotto-suhteen. Sijoitustavoitteena on antaa tuloksia, jotka ovat linjassa vertailupohjan kanssa",3 stars,4 / 7,8,76,"1,60%",Maantiede,Kehittyneet maat – suuret yhtiöt,Japani suuret yhdistelmä
Jupiter Japan Select L EUR Acc,EUR,"The investment objective of the fund is to achieve long term capital growth through investing primarily in Japan and in selected opportunities in Asia. The Fund will invest primarily in equity and equity related securities (including listed preference shares, listed convertible unsecured loan stock, listed warrants, depositary receipts and other similar securities) of companies which have their registered office or exercise the predominant part of their economic activities in Japan.",3 stars,4 / 7,8,135,"1,72%",Maantiede,Kehittyneet maat – suuret yhtiöt,Japani suuret yhdistelmä
Ålandsbanken Eurooppa Osake B,EUR,"Rahaston varat sijoitetaan eurooppalaisiin osakkeisiin aktiivisen arvostrategian mukaisesti. Rahasto pyrkii luomaan riski-tuotto-suhteeltaan tehokkaan salkun, toimiala-allokaatioiden ja yhtiövalintojen avulla. Valituilta toimialoilta haetaan hyviä ja edullisesti arvostettuja yhtiöitä. Rahaston tavoitteena on pitää yli 90% varoistaan sijoitettuna osakemarkkinoille normaalissa markkinatilanteessa. Rahasto voi myös hyödyntää johdannaisinstrumentteja suojatakseen sijoituksiaan ja edistääkseen tehokasta salkunhoitoa.",3 stars,4 / 7,8,101,"1,40%",Maantiede,Kehittyneet maat – suuret yhtiöt,Eurooppa suuret sekatyyli
DWS Invest Convertibles LC,EUR,"This sub-fund promotes environmental and social characteristics and reports as product in accordance with article 8(1) of Regulation (EU) 2019/2088 on sustainability related disclosures in the financial services sector (“SFDR”). While the sub-fund does not have as its objective a sustainable investment, it will invest a minimum proportion of its assets in sustainable investments as defined by article 2 (17) SFDR. The objective of the investment policy of the fund is to generate an above-average return for the sub-fund in Euros. However, no assurance can be given that the investment objective will be achieved. The sub-fund is actively managed and is not managed in reference to a benchmark.",2 stars,3 / 7,8,40,"1,33%",Korko,Vaihtovelkakirjat,
Lannebo High Yield A,SEK,-,4 stars,2 / 7,8,1542,"0,91%",Korko,High Yield,
SKAGEN Vekst A,NOK,"SKAGEN Vekst invests a minimum of 50 % of its assets in Norway. The fund has a worldwide investment mandate for the remainder of the assets. The fund’s aim is to find high quality companies at a low price, which are characterised by being undervalued, under-researched and unpopular. The combination of a Norwegian and a global mandate allows the fund to take part in value creation in sectors that are not available on the Norwegian market.",3 stars,3 / 7,8,935,"1,00%",Tyyli,arvoyhtiöt,
abrdn-Asian Smaller Companies A Acc USD,USD,"The Fund's investment objective is long term total return to be achieved by investing at least 70% of the Fund’s assets in smaller capitalisation equities and equity-related securities of companies listed, incorporated or domiciled in Asia Pacific (excluding Japan) countries or companies that derive a significant proportion of their revenue or profits from Asia Pacific excluding Japan) countries operations or have a significant proportion of their assets there. The Fund may invest up to 30% of its net assets in Mainland China equity and equity-related securities, although only up to 20% of its net assets may be invested directly through QFI regime, the Shanghai-Hong Kong and Shenzhen-Hong Kong Stock Connect programme or by any other available means.",3 stars,4 / 7,8,306,"1,94%",Maantiede,Aasia ei-Japani / Aasia-Tyynimeri,Aasia ei-Japani small/mid
BGF Japan Flexible Equity A2,USD,"The fund seeks to maximise total return in a manner consistent with the principles of environmental, social and governance (“ESG”) investing. The Fund invests at least 70% of its total assets in the equity securities of companies domiciled in or exercising the predominant part of their economic activity in, Japan. The Fund normally invests in securities that, in the opinion of the Investment Adviser, exhibit either growth or value investment characteristics, placing an emphasis as the market outlook warrants. The Fund may use derivatives for investment purposes and for the purposes of efficient portfolio management.",4 stars,4 / 7,8,219,"1,81%",Maantiede,Kehittyneet maat – suuret yhtiöt,Japani suuret yhdistelmä
Danske Invest Europe A,EUR,"Rahasto tavoittelee markkinoiden yleisen kehityksen ylittävää tuottoa. Osuuslajin osuudet ovat kasvuosuuksia. Rahasto sijoittaa pääosin eurooppalaisiin osakkeisiin. Pienen osan varoistaan rahasto voi sijoittaa itäeurooppalaisiin tai Itä-Euroopan reuna-alueiden osakkeisiin. Rahasto voi sijoittaa maihin, jotka luokitellaan kehittyviksi markkinoiksi.",3 stars,4 / 7,8,381,"1,77%",Maantiede,Kehittyneet maat – suuret yhtiöt,Eurooppa suuret sekatyyli
Pictet-Emerging Markets P EUR,EUR,Rahasto sijoittaa ns. kehittyvien maiden osakemarkkinoille.,2 stars,4 / 7,8,4,"1,75%",Maantiede,Kehittyvät maat,Kehittyvät maat
Nordnet One Rohkea EUR,EUR,"Nordnet Rohkea EUR on rahasto-osuusrahasto, jolla on altistusta globaaleille osake-, korko- ja luottomarkkinoille. Osakemarkkinoille altisteisten sijoitusten ohjearvo on 100 prosenttia. Rahaston tavoitteena on saavuttaa pitkän aikavälin arvonnousua laajalla hajautuksella.",5 stars,4 / 7,8,22926,"0,49%",Yhdistelmä,Riskipitoinen,
Nordnet Maailma Indeksi 125,EUR,"Rahasto pyrkii seuraamaan MSCI World Climate Change Leveraged 1.25x Select Index -indeksin (Bloomberg Ticker: MXWCCLNU), (”indeksi”) Yhdysvaltain dollarin määräistä nettokokonaistuottoa, josta vähennetään palkkiot ja kulut. Indeksi on vivutettu indeksi. Indeksi on vipukäyttöinen indeksi. Indeksin tason kuukausittaisen prosenttimuutoksen on tarkoitus heijastaa 1,25-kertaista kuukausittaista prosenttimuutosta kohde-etuusindeksin tasossa miinus pääoman lisälainauksen kustannukset kohde-etuusindeksisalkkuun sijoittamista varten, jotta saadaan aikaan vipuvaikutettu sijoitus. Kohde-indeksi on MSCI World Climate Change Index, joka koostuu MSCI World Index -indeksiin kuuluvista yrityksistä, jotka ovat uudelleenpainotettuja hiilipäästöprofiilinsa perusteella. Valuuttakurssimuutosten riski indeksin valuutan ja kunkin lajin valuutan välillä ei ole suojattu. Rahastoa hallinnoivat rinnakkain Nordnet Fonder AB ja J.P. Morgan Mansart Management Limited.",0 stars,4 / 7,8,11366,"0,49%",Maantiede,Maailma,
Spiltan Högräntefond,SEK,-,3 stars,2 / 7,8,2663,"0,80%",Korko,High Yield,
S-Pankki Eurooppa Osake A,EUR,"Rahaston varat sijoitetaan eurooppalaisten yritysten osakkeisiin. Rahaston sijoitustoiminnan tavoitteena on aktiivisella rahastonhoidolla saada sijoitetuille varoille mahdollisimman hyvä pitkän aikavälin tuotto, joka ylittää vertailuindeksin tuoton. Vertailuindeksinä käytetään euromääräistä MSCI Daily Net TR Europe Euro -tuottoindeksiä.",3 stars,4 / 7,8,57,"1,80%",Maantiede,Kehittyneet maat – suuret yhtiöt,Eurooppa suuret sekatyyli
Aktia Nordic Micro Cap B,EUR,"Rahasto on osakerahasto, joka sijoittaa varansa pääsääntöisesti pienyhtiöiden osakkeisiin ja osakesidonnaisiin instrumentteihin pohjoismaisilla markkinoilla. Pienellä yrityksellä tarkoitetaan yritystä, jonka markkina-arvo sijoitushetkellä on alle 500 miljoonaa euroa. Rahaston omistusten lukumäärä on lähtökohtaisesti 30-45 yhtiötä.",2 stars,4 / 7,8,2789,"2,04%",Maantiede,Kehittyneet maat – small/mid ja keskisuuret,Pohjoismaat small/mid
Evli Nordic High Yield B SEK,SEK,"Rahasto sijoittaa varansa pääosin pohjoismaisiin yrityslainoihin. Sijoituksia tehdään luokiteltuihin Investment Grade- ja High Yield -lainoihin sekä luokittelemattomiin yrityslainoihin. Yksittäisestä liikkeellelaskijasta syntyvää luottoriskiä pienennetään hajauttamalla sijoitukset useiden eri liikkeeseenlaskijoiden kesken. Rahaston sijoitustoiminnassa noudatetaan Evlin vastuullisen sijoittamisen linjauksia. Rahasto sulkee pois sijoituksistaan kiistanalaisten aseiden ja tupakan valmistajien lisäksi alkoholin, uhkapelin, aikuisviihteen, aseiden ja fossiilisten polttoaineiden (louhiminen, kaivaminen ja poraaminen) valmistajat. Rahasto ei edellytä sijoituskohteiden luottoluokitusta, minkä johdosta rahaston sijoituskohteisiin liittyy keskimääräinen tai korkea luottoriski. Rahaston korkosijoitusten keskimääräinen takaisinmaksuaika (duraatio) on Rahaston toiminnan alkaessa keskimäärin enintään 5 vuotta eikä",0 stars,3 / 7,8,22,"1,01%",Korko,High Yield,
SEB Europe Equity Fund C EUR,EUR,"Rahasto sijoittaa varansa keskieurooppalaisiin osakkeisiin ja osakesidonnaisiin arvopapereihin eri aloille, pääosin Saksassa, Ranskassa, Sveitsissä, Itävallassa, Belgiassa ja Hollannissa. Rahasto voi hyödyntää optioita ja termiinisopimuksia. Rahaston varat on yleensä sijoitettu kokonaisuudessaan lukuun ottamatta transaktioihin tarvittavia käteisvaroja. Rahasto ei jaa voitto-osuutta, tuotto sijoitetaan uudelleen.",3 stars,4 / 7,8,700,"1,25%",Maantiede,Kehittyneet maat – suuret yhtiöt,Eurooppa suuret sekatyyli
JupiterMerian World Eq L $ Acc,USD,Rahaston tavoitteena on ylittää liukuvina kolmivuotiskausina vertailuindeksinsä kehitys. Rahasto hajauttaa varansa noterattuihin kansainvälisiin osakkeisiin joilla käydään kauppaa säännellyillä markkinoilla ympäri maailman. Rahaston varat voidaan kohdistaa rahastoihin tai suoraan arvopapereihin.,5 stars,4 / 7,8,142,"1,69%",Maantiede,Maailma,
Invesco Asia Opportunities Eq A USD Acc,USD,Rahaston tavoitteena on pitkän aikavälin pääomankasvu. Rahasto sijoittaa ensisijaisesti aasialaisten potentiaalisten kasvuyritysten (mukaan lukien pienet ja keskisuuret yritykset) osakkeisiin. Rahaston määritelmän mukaan Aasia käsittää Intian niemimaan mutta ei Japania ja Australaasiaa. Rahastoa hallinnoidaan aktiivisesti sen tavoitteiden puitteissa eikä sitä ole sidottu vertailuindeksiin.,2 stars,4 / 7,8,25,"2,03%",Maantiede,Aasia ei-Japani / Aasia-Tyynimeri,Aasia ei-Japani
Lannebo Sustainable Corporate Bond A SEK,SEK,"Lannebo Sustainable Corporate Bond is an actively managed fixed income fund that mainly invests in corporate bonds issued by companies in the Nordic region and to a certain extent in the rest of Europe. The fund invests in green bonds *, bonds issued by companies that are deemed to be sustainable or that produce goods or services aimed at solving sustainability challenges. The estimated average credit rating for the fund's investments is at the lowest investment grade, BBB-. * A green bond is a bond where the capital is earmarked for use in environmental projects and has been certified by a third party actor.",3 stars,2 / 7,8,337,"0,51%",Korko,High Yield,
JPM Europe Dynamic Sm Cp A perf (acc)EUR,EUR,To maximise long-term capital growth by investing primarily in an aggressively managed portfolio of small capitalisation European companies.,3 stars,4 / 7,8,12,"1,81%",Maantiede,Kehittyneet maat – small/mid ja keskisuuret,Eurooppa pienyhtiöt
Invesco China Focus Equity A USD Acc,USD,"The objective of the Fund is to achieve long term capital growth by investing in equity or equity-related securities of companies with exposure to China. The Investment Manager will seek to invest the Fund’s assets primarily in listed equity or equity-related securities issued by (i) companies and other entities having their registered office in China, or (ii) companies and other entities located outside China carrying out business activities predominantly in China, or (iii) holding companies, the interests of which are predominantly invested in subsidiary companies with a registered office in China.",4 stars,5 / 7,8,190,"2,19%",Maantiede,Aasia ei-Japani / Aasia-Tyynimeri,Kiina
HSBC GIF Frontier Markets AC,USD,"The sub-fund invests for long term total returns primarily in a diversified portfolio of Frontier Markets equities. The sub-fund invests in normal market conditions a minimum of 90% of its net assets in equity and equity equivalent securities of companies which have their registered office in, and with an official listing on a major stock exchange or other Regulated Market in Frontier Markets, as well as those companies with significant operations or carrying out a preponderant part of their business activities in these countries.",4 stars,4 / 7,6,558,"2,25%",Maantiede,Maailma,Frontier-markkinat
Jupiter Global EMs Focus L USD Acc,USD,"The objective of the Fund is to seek to achieve asset growth through investment in a well-diversified portfolio of equity securities of issuers in the Emerging Markets or of issuers established outside of the Emerging Markets, which have a predominant proportion of their assets or business operations in the Emerging Markets and which are listed, traded or dealt in on a Regulated Market worldwide. It is not proposed to concentrate investments in any one industry or sector. The Fund takes sustainability risk and ESG Characteristics (as defined below) into account as part of its selection process (as further described in section “Sustainability Approach” below).",2 stars,4 / 7,8,25,"1,80%",Maantiede,Kehittyvät maat,Kehittyvät maat
Aktia Osakesalkku B,EUR,"Rahasto on osakerahasto, joka sijoittaa varansa maailmanlaajuisesti osakemarkkinoille sijoittavien sijoitusrahastojen rahasto-osuuksiin tai yhteissijoitusyritysten osuuksiin. Rahasto voi sijoittaa myös Aktia Rahastoyhtiön hallinnoimien rahastojen rahasto-osuuksiin. Rahaston maantieteellinen neutraaliallokatio on 20 % Eurooppa, 25 % Pohjois-Amerika, 20 % Pohjoismaat, 30 % Kehittyvät ja Frontier-markkinat ja 5 % Japani.",2 stars,4 / 7,8,152,"1,11%",Maantiede,Maailma,
Fidelity Fds-Euro Blue Chip A Udb,EUR,"Fidelity Euro Blue Chip Fund on osakerahasto, joka sijoittaa pääasiallisesti EMU-maiden ns. Blue Chip-yrityksiin.",3 stars,4 / 7,8,42,"1,94%",Maantiede,Kehittyneet maat – suuret yhtiöt,Eurooppa suuret sekatyyli
Fidelity Global Focus A-Acc-USD,USD,"The Fund aims to achieve long-term capital growth from a portfolio primarily invested in stocks across the world’s stock markets. The manager is free to select any company regardless of size, industry or location and will concentrate its investments in a more limited number of companies and therefore the resulting portfolio will be less diversified.",3 stars,4 / 7,8,50,"1,91%",Maantiede,Maailma,
BNP Paribas US Growth Classic C,USD,The investment objective of the fund is to increase the value of its assets over the medium term by investing primarily in US growth equities.,3 stars,5 / 7,8,332,"1,96%",Tyyli,kasvuosakkeet,
UBS (Lux) Eq Eurp Opp (EUR) P acc,EUR,"Rahasto sijoittaa pääasiassa tärkeimpiin länsi-eurooppalaisiin yrityksiin. - Yritysten suhteellisen painotuksen määrittäminen perustuu mm. seuraaviin laatukriteereihin: yrityksen strategia, vahva markkina-asema, korkealaatuinen johtaminen, vakaa tuotto, kasvupotentiaali sekä omistaja-arvon (shareholder value) nostaminen. Hajautus saadaan aikaan ottamalla mukaan useita maita ja eri toimialoja ja tästä syystä rahasto tarjoaa sijoittajalle parhaan mahdollisen riski/tuotto-suhteen.Sijoitustavoitteena on antaa tuloksia, jotka ovat linjassa vertailupohjan kanssa (benchmarking).",3 stars,4 / 7,8,37,"1,90%",Maantiede,Kehittyneet maat – suuret yhtiöt,Eurooppa suuret sekatyyli
BNP Paribas Europe Eq C C,EUR,The investment objective of the fund is to increase the value of its assets over the medium term by investing primarily in European equities.,2 stars,4 / 7,8,13,"1,96%",Maantiede,Kehittyneet maat – suuret yhtiöt,Eurooppa suuret sekatyyli
