Nimi,Valuutta,Tietoa,Rating,Riski,Vastuullisuus (SFDR),Omistajia Nordnetissä,Kulut,Kategoria,Yläluokka,Alakategoria
DWS Invest ESG Eurp Small/Mid Cap LC,EUR,"This sub-fund promotes environmental and social characteristics and reports as product in accordance with article 8(1) of Regulation (EU) 2019/2088 on sustainability-related disclosures in the financial services sector (“SFDR”). While the sub-fund does not have as its objective a sustainable investment, it will invest a minimum proportion of its assets in sustainable investments as defined by article 2 (17) SFDR. The sub-fund’s investment objective is to achieve the highest possible appreciation of capital in euro, in combination with a reasonable annual distribution of income. The sub-fund is actively managed and is not managed in reference to a benchmark. At least 80% of the sub-fund`s assets are invested in equities.",3 stars,4 / 7,8,183,"1,58%",Maantiede,Kehittyneet maat – small/mid ja keskisuuret,Eurooppa mid-cap
SEB US Focus Core Fund C (EUR),EUR,"SEB US Focus Core Fund pyrkii kasvattamaan rahastosijoituksen arvoa ajan myötä ja ylittämään vertailuindeksin tuoton. Rahasto sijoittaa pääasiassa yhdysvaltalaisten yritysten osakkeisiin. Rahasto sijoittaa vähintään 85 % nettovaroistaan minkä tahansa kokoisten ja minkä tahansa sektorien yhdysvaltalaisten tai Yhdysvaltain säännellyillä markkinoilla vaihdettujen yritysten osakkeisiin ja osakesidonnaisiin arvopapereihin. Sijoitustiimi hallinnoi rahaston sijoituksia perustekijästrategialla valikoidakseen yrityksiä, joiden se uskoo tarjoavan parhaan potentiaalin pitkän aikavälin pääoman arvonnousulle. Tavoitteena on rakentaa keskitetty salkku, johon sisältyy pääosin alojensa johtavia yrityksiä (ns. core-yhtiöt). Rahasto käyttää ympäristö-, yhteiskunta- ja hallintoseikkoja (ESG) koskevia kriteereitä sijoitusprosessin keskeisenä elementtinä ja pyrkii vaikuttamaan yrityksiin aktiivisella omistajaohjauksella kestävään kehitykseen liittyvissä asioissa.",3 stars,4 / 7,8,4,"1,55%",Maantiede,Kehittyneet maat – suuret yhtiöt,Yhdysvallat suuret sekatyyli
Ålandsbanken Varainhoito B,EUR,"Normaalissa markkinatilanteessa rahaston varoista sijoitetaan 50% osakerahastoihin ja 50% korkorahastoihin. Tarpeen mukaan osake- ja korkorahastojen osuudet voivat vaihdella: osakerahastot 30-70% ja korkorahastot 30-70% rahaston varoista. Rahasto noudattaa sijoituksissaan aktiivista sijoitusstrategiaa. Rahaston kehitykseen vaikuttavat osake- ja korkorahastosijoitusten välinen suhde sekä rahaston salkunhoitajan kyky valita menestyviä rahastoja sijoituskohteiksi. Rahasto sijoittaa objektiivisuussyystä varojaan vain sijoitusrahastoihin, jotka eivät ole Ålandsbanken Rahastoyhtiön hallinnoimia.",4 stars,3 / 7,8,97,"1,30%",Yhdistelmä,Maltillinen,
SEB Mixed 80 C (EUR),EUR,"Tämä aktiivisesti hallinnoitu rahasto pyrkii kasvattamaan rahastosijoituksen arvoa ajan myötä ja ylittämään vertailuindeksin tuoton. Rahastonhoitaja tekee aktiivisia sijoituspäätöksiä vallitsevien markkinanäkymien analyysin ja huolellisten valintojen pohjalta. Rahasto sijoittaa suoraan tai epäsuorasti osakkeisiin, velkaarvopapereihin ja rahamarkkinainstrumentteihin. Rahaston tavoitteena on sijoittaa 80 % globaaleihin osakkeisiin ja osakesidonnaisiin arvopapereihin, mukaan lukien kehittyvien markkinoiden osakkeet. Rahaston nettoaltistus osakkeisiin voi kuitenkin vaihdella markkinatekijöistä riippuen eri aikoina 60-100 % välillä.",4 stars,3 / 7,8,258,"1,43%",Yhdistelmä,Riskipitoinen,
JPM Global Balanced A (dist) EUR,EUR,"The investment objective of the fund is to provide long-term capital growth and income by investing primarily in companies and debt securities issued or guaranteed by governments or their agencies, globally, using derivatives where appropriate. Multi-asset approach, combining asset allocation with bottom-up expertise leveraged from specialists from JPMorgan Asset Management’s global investment platform. Actively managed implementation of equity and bond strategies, with a balanced risk profile.",3 stars,3 / 7,8,57,"1,66%",Yhdistelmä,Maltillinen,
Handelsbanken Usa Indeksi,EUR,"Rahasto on indeksirahasto, jonka tavoitteena on seurata Solactive ISS ESG Screened USA -indeksiä niin tarkasti kuin mahdollista. Rahasto sijoittaa Amerikan osakemarkkinoille. Indeksi koostuu suurista ja keskisuurista USA:n pörssissä noteeratuista yhtiöistä pois sulkien ne, jotka eivät täytä indeksin vastuullisuusvaatimuksia. Rahaston sijoituspolitiikan puitteissa huomioidaan kansainväliset normit ja säännöt koskien ympäristöä, sosiaalista vastuuta ja omistajaohjausta.",4 stars,4 / 7,9,93159,"0,20%",Maantiede,Kehittyneet maat – suuret yhtiöt,Yhdysvallat suuret sekatyyli
Nordnet One Varovainen EUR,EUR,"Nordnet Varovainen EUR on rahasto-osuusrahasto, jolla on altistusta globaaleille osake-, korko- ja luottomarkkinoille. Osakemarkkinoille altisteisten sijoitusten ohjearvo on 30 prosenttia. Rahaston tavoitteena on saavuttaa pitkän aikavälin arvonnousua laajalla hajautuksella.",5 stars,3 / 7,8,4093,"0,48%",Yhdistelmä,Varovainen,
Franklin Alt Strats A(acc)EUR-H1,EUR,The Fund's investment objective is to seek capital appreciation with lower volatility relative to the broad equity markets.,2 stars,4 / 7,8,7,"2,55%",Vaihtoehtoinen,Multistrategia (EUR),
Jupiter European Growth L EUR Acc,EUR,"The fund seeks to achieve long term capital growth by exploiting special investment opportunities in Europe. The Fund will invest primarily in equity and equity related securities (including listed preference shares, listed convertible unsecured loan stock, listed warrants and other similar securities) of issuers which have their registered office in Europe or exercise the predominant part of their economic activities in Europe (including UK) and which are considered by the Investment Manager to be undervalued or otherwise to offer good prospects for capital growth.",2 stars,4 / 7,8,413,"1,72%",Maantiede,Kehittyneet maat – suuret yhtiöt,Eurooppa suuret sekatyyli
Fidelity Fds- Euro Balanced A Udb,EUR,"The fund aims to provide income over time. The fund invests at least 70% of its assets in equities and debt securities of issuers that are listed, headquartered, or do most of their business in Europe, and European governments.",3 stars,3 / 7,8,70,"1,49%",Yhdistelmä,Maltillinen,
Evli High Yield Yrityslaina B,EUR,"Sijoitusrahasto Evli High Yield Yrityslaina on pitkän koron yrityslainarahasto, joka sijoittaa varansa pääasiassa eurooppalaisten yritysten ja pankkien liikkeeseen laskemiin euromääräisiin joukkovelkakirjoihin. Sijoitusten painopiste on alemman luottoluokituksen (High Yield) lainoissa, ja sijoituskohteiden luottoluokitus on keskimäärin korkeintaan BB+. Lisäksi enintään 20 % rahaston varoista voidaan sijoittaa kohteisiin, joilla ei ole virallista luottoluokitusta.",4 stars,2 / 7,8,1416,"0,97%",Korko,High Yield,
S-Pankki USA Osake A,EUR,"Rahaston varat sijoitetaan yhdysvaltalaisten tai sellaisten yhtiöiden osakkeisiin ja osakesidonnaisiin arvopapereihin, joille Yhdysvallat on keskeinen markkina-alue. Rahaston sijoitustoiminnan tavoitteena on aktiivisella rahastonhoidolla saada sijoitetuille varoille mahdollisimman hyvä pitkän aikavälin tuotto, joka ylittää vertailuindeksin tuoton. Vertailuindeksinä käytetään euromääräistä MSCI USA (tr) -tuottoindeksiä.",4 stars,4 / 7,8,296,"1,50%",Maantiede,Kehittyneet maat – suuret yhtiöt,Yhdysvallat suuret sekatyyli
Handelsbanken Pohjois Pien (A1 EUR),EUR,"Rahasto on aktiivisesti hoidettu osakerahasto, jonka tavoitteena on hyvällä riskien hajautuksella saavuttaa pitkällä aikavälillä tuotto, joka ylittää pohjoismaisten pienyritysten markkinoiden tuoton. Rahasto sijoittaa pieniin ja keskisuuriin yrityksiin Tanskassa, Suomessa, Norjassa ja Ruotsissa. Näiden yritysten markkina-arvo ei ostohetkellä saa ylittää 0,5 prosenttia niiden markkinoiden yhteisarvosta, joihin rahasto saa sijoittaa. Rahasto voi myös sijoittaa isompiin yrityksiin, jos katsomme sen olevan osuudenomistajien etu.",3 stars,4 / 7,8,628,"1,60%",Maantiede,Kehittyneet maat – small/mid ja keskisuuret,Pohjoismaat small/mid
Aktia European High Yield Bond+ B,EUR,"Rahasto on aktiivisesti hoidettu, pitkän koron rahasto, joka sijoittaa pääasiallisesti eurooppalaisten pankkien ja yritysten liikkeeseenlaskemiin, korkean luottoriskin korkotuotteisiin. Vähintään 75 % varoista sijoitetaan kohteisiin tai liikkeeseenlaskijoihin, jotka omaavat matalamman luottoluokituksen. Lisäksi enintään 20 % sijoituksista voidaan tehdä korkotuotteisiin, joilla ei ole luottoluokitusta.",4 stars,2 / 7,8,504,"0,81%",Korko,High Yield,
GS Glb Sm Cp CORE Eq Base Inc USD Close,USD,The Portfolio seeks long-term capital appreciation by investing primarily in equity securities of small capitalisation companies that are domiciled anywhere in the world.,4 stars,4 / 7,8,1272,"1,41%",Maantiede,Maailma,Maailma small/mid
Vontobel Commodity B USD,USD,The Sub-Fund aims to achieve sustainable investment returns in USD. The Sub-Fund may also be exposed to the development of the commodities sector via investments in UCITS or other UCIs within the permitted limits including undertakings for collective investment managed by a company belonging to the Vontobel Group.,0 stars,4 / 7,6,510,"1,83%",Sektori,Raaka-aineet laaja,
Allianz Euro High Yield Bond A EUR,EUR,Long-term capital growth by investing in high yield rated Debt Securities denominated in EUR.,3 stars,2 / 7,8,97,"1,40%",Korko,High Yield,
BGF Fixed Income Global Opps A2 EUR H,EUR,"The Fund seeks to maximise total return. The Fund invests at least 70% of its total assets in fixed income transferable securities denominated in various currencies issued by governments, agencies and companies worldwide. The full spectrum of available securities, including non-investment grade, may be utilised. Currency exposure is flexibly managed.",3 stars,3 / 7,6,13,"1,20%",Korko,Joustava,
Spiltan Aktiefond Stabil,SEK,"Spiltan Aktiefond Stabil - tarjoaa kokonaisvaltaisen ratkaisun, jossa säästetään laajassa sekä laajapohjaisessa osakesalkussa, jossa sijoitukset ovat pörssinoteeratuissa, laadukkaissa yhtiöissä. Painopiste on vakaissa yhtiöissä sekä investointiyhtiöissä. Sijoitukset muissa rahastoissa ja erilaiset markkinainstrumentit takaavat vakaan tuoton, joka myös laskee yhtiön kokonaistappion vaaraa. Rahasto on täysin riippumaton eri indeksipainoista. Oasakerahaston - Vakaa - tavoitteena on ensi sijassai luoda vakaa, positiivinen tuotta (7% vuosittain) sekä toiseksi menestyä paremmin kuin verrattavissa olevat rahstot/indeksi.",3 stars,4 / 7,8,4636,"1,50%",Maantiede,Kehittyneet maat – small/mid ja keskisuuret,Ruotsi
Schroder ISF Nordic Smlr Coms A € Acc,EUR,The Fund aims to provide capital growth in excess of the MSCI Nordic Smaller Companies (Net TR) index after fees have been deducted over a three to five year period by investing in equity or equity related securities of small-sized Nordic companies.,3 stars,5 / 7,8,13,"1,84%",Maantiede,Kehittyneet maat – small/mid ja keskisuuret,Pohjoismaat small/mid
SEB Global High Yield C EUR,EUR,"Rahasto sijoittaa joukkovelkakirjalainoihin joiden liikkeeseenlaskijayritykset kuuluvat Non-investment Grade -segmentin eli ns. High Yield yhtiöt, joilla on merkittävä luottoriski. High Yield -luokkaan luokiteltujen joukkovelkakirjalainojen luottoluokitus on BB+–D, jossa D vastaa yrityksiä, jotka eivät ole täyttäneet luottositoumuksiaan (default). Suurin osa rahaston varoista on sijoitettu yrityksiin, joiden luottokelpoisuuden arvioidaan olevan hieman korkeampi High Yield -segmentissä. Rahasto hajauttaa sijoituksensa eri toimialoilla toimivien yhdysvaltalaisten ja eurooppalaisten yritysten liikkeeseen laskemien joukkovelkakirjalainojen kesken. Rahastolla on mahdollisuus käyttää johdannaisinstrumentteja. Osuuslajin tavoitteena on olla valuuttasuojattu rahaston perusvaluutan heilahteluilta. Rahasto voi sijoittaa muihin kuin edellä mainittuihin instrumentteihin.",2 stars,2 / 7,8,33,"1,06%",Korko,High Yield,
Ålandsbanken Euro High Yield B,EUR,"Rahaston tavoitteena on saavuttaa hyvä arvonkehitys pitkällä aikavälillä hyödyntämällä High Yield -yrityslainamarkkinoiden tarjoamia korkeampia tuottomahdollisuuksia. Rahaston varat sijoitetaan valikoidusti High Yield -luokiteltuihin yrityslainoihin (H.Y. yrityslainoja jotka tarjoavat paremmat tuottomahdollisuudet mutta joilla on myös korkeampi riski liikkeeseenlaskijoiden luottokelpoisuusluokitusten perusteella. Liikkeeseenlaskijoiden vakavaraisuus on tyypillisesti keskimääräistä heikompi). Rahasto sijoittaa euromääräisiin yrityslainoihin ja noudattaa salkunhoidossaan aktiivista strategiaa, jonka perustana ovat toimialavalinnat sekä obligaatioiden harkittu valinta.",3 stars,2 / 7,8,194,"1,00%",Korko,High Yield,
Fidelity European Sm Cos A Udb,EUR,"Fidelity European Smaller Companies on osakerahasto, joka sijoittaa iso-britannialaisiin ja mannereurooppalaisiin pienyrityksiin (markkina-arvo alle $1 miljardin).",3 stars,4 / 7,8,432,"1,91%",Maantiede,Kehittyneet maat – small/mid ja keskisuuret,Eurooppa pienyhtiöt
Allianz Little Dragons A2 EUR,EUR,"Long-term capital growth by investing in Asian Equity Markets, excluding Japan, with a focus on small-sized and mid-sized companies.",2 stars,4 / 7,6,57,"2,30%",Maantiede,Aasia ei-Japani / Aasia-Tyynimeri,Aasia ei-Japani
Fidelity Glb Thematic Opps A-USD,USD,"Fidelity International Fund on osakerahasto, joka sijoittaa kansainvälisille osakemarkkinoille mukaanlukien kehittyvät markkinat.",3 stars,4 / 7,8,56,"1,90%",Tyyli,kasvuosakkeet,
HSBC GIF Euro High Yield Bond AC,EUR,"The sub-fund aims to provide long term total return by investing in a portfolio of Euro denominated high yielding bonds, while promoting ESG characteristics within the meaning of Article 8 of SFDR. The sub-fund aims to do this with a higher ESG rating, calculated as a weighted average of the ESG ratings given to the issuers of the sub-fund’s investments, than the weighted average of the constituents of the ICE BofA Euro High Yield BB-B Constrained1 (the “Reference Benchmark”). The sub-fund invests (normally a minimum of 90% of its net assets) in Non-Investment Grade rated fixed income securities and other higher yielding securities (including unrated bonds) which are either issued by companies or issued or guaranteed by government, government agencies or supranational bodies in both developed markets and Emerging Markets. These securities are denominated in Euro and, on an ancillary basis (normally up to 10% of the sub-fund's net assets), in other developed market currencies.",3 stars,3 / 7,8,74,"1,35%",Korko,High Yield,
Fidelity Global Financial Svcs A-Dis-EUR,EUR,Rahasto sijoittaa maailmanlaajuisesti pankki & rahoitus alan yrityksiin.,3 stars,4 / 7,8,407,"1,90%",Sektori,Rahoituspalvelut,
Fidelity European Hi Yld A-Acc-EUR,EUR,"The fund aims to achieve capital growth over time and provide a high level of income. The fund invests at least 70% of its assets, in high-yielding below investment grade debt securities of issuers that are headquartered, or do most of their business, in Western, Central and Eastern Europe (including Russia), including emerging markets.",3 stars,2 / 7,8,61,"1,40%",Korko,High Yield,
S-Pankki Kehittyvät Markkinat Korko A,EUR,"""Rahaston sijoitustoiminnan tavoitteena on aktiivisella omaisuudenhoidolla saada sijoitetuille varoille mahdollisimman hyvää tuottoa kehittyvien maiden korkomarkkinoilta keskipitkällä aikavälillä. Rahasto sijoittaa varansa maailmanlaajuisesti pääasiassa kehittyvien valtioiden liikkeeseen laskemiin joukkolainoihin, mutta n. 15 % varoista voi olla sijoitettuna kyseisissä maissa sijaitsevien yritysten joukkolainoihin. Rahasto ei yleensä sijoita kaikkein korkeariskisimpiin liikkeeseenlaskijoihin, joiden riskiluokitus on CCC+/Caa1 tai huonompi. """,3 stars,3 / 7,6,96,"0,90%",Korko,Kehittyvät maat,
UBS (Lux) KSS Global Eqs $ EUR P-acc,EUR,"The sub-fund as an ESG integration fund which does not promote particular ESG characteristics or pursues a specific sustainability or impact objective. In line with the above-mentioned investment policy, the sub-fund invests at least two thirds of its assets in equities and equity rights worldwide. In so doing, the sub-fund may invest up to 25% of its assets in equities and equity rights of companies domiciled or chiefly active in emerging markets.",2 stars,4 / 7,6,16,"2,10%",Maantiede,Maailma,
Amundi Fds Multi-Strat Gr A EUR C,EUR,L’objectif de ce Compartiment est d’obtenir un rendement absolu et la préservation du capital sur le moyen et le long terme. Il se concentre sur le risque et le rendement absolus du portefeuille en investissant au moins deux tiers de la totalité de ses actifs dans un portefeuille diversifié composé d’actions et d’instruments apparentés à des actions de même que de tout type de titres de créance et d’instruments d’emprunt.,3 stars,4 / 7,8,43,"1,63%",Vaihtoehtoinen,Makrotreidaus (EUR),
Storebrand Global Plus A EUR,EUR,"Storebrand Global Plus on indeksiä lähellä oleva vastuullinen osakerahasto, joka sijoittaa laajasti eri toimialojen osakkeisiin maailman osakemarkkinoilla.Rahasto keskittyy kestävän kehityksen yrityksiin ja voi sijoittaa jopa 10 prosenttia rahaston varoista ratkaisuyrityksiin. Rahasto noudattaa vastuullisen sijoittamisen periaatteitamme. Niiden mukaisesti emme sijoita muun muassa yrityksiin,jotka rikkovat kansainvälisiä sääntöjä ja sopimuksia. Nämä koskevat ihmisoikeuksia, työlainsäädäntöä ja kansainvälistä oikeutta,korruptiota, talousrikollisuutta, vakavia ilmasto- ja ympäristövahinkoja ja kiistanalaisia aseita (maamiinat, rypälepommit ja ydinaseet). Suljemme pois myös yritykset, joiden liikevaihdosta yli 5 % tulee tupakkatuotteiden,aseiden,alkoholin, uhkapelien,pornografian,kannabistuotteiden ja fossiilisten polttoaineiden valmistamisesta ja/tai jakelusta, sekä yritykset, joilla on suuret fossiilisten polttoaineiden varannot.",3 stars,4 / 7,8,668,"0,41%",Maantiede,Maailma,
Evli Pohjoismaat Yrityslaina B,EUR,"Sijoitusrahasto Evli Pohjoismaat Yrityslaina on pitkän koron yrityslainarahasto, joka sijoittaa varansa pääasiassa pohjoismaisten yritysten, rahoituslaitosten ja muiden yhteisöjen liikkeeseen laskemiin lainoihin. Sijoituksia tehdään luottoluokiteltuihin investment grade- ja high yield –lainoihin sekä luottoluokittelemattomiin yrityslainoihin. Rahasto voi sijoittaa myös johdannaissopimuksiin sekä suojaustarkoituksessa että osana rahaston tavoitteiden mukaista sijoitustoimintaa.",4 stars,2 / 7,8,354,"0,75%",Korko,Joustava,
Jupiter EM Mkt Dt L € H Acc,EUR,The objective of the fund is to seek to achieve asset growth through investment in a well-diversified portfolio of fixed and variable rate debt securities issued in Emerging Markets.,2 stars,3 / 7,6,7,"1,95%",Korko,Kehittyvät maat,
GS Glbl Hi Yld Oth Ccy Inc EUR Hdg,EUR,"Rahasto on kansainvälinen korkorahasto, joka sijoittaa pääasiassa alhaisen luottoluokituksen omaaviin yrityslainoihin, niin kutsuttuihin High Yield -obligaatioihin. High Yield -obligaatiot mahdollistavat paremman tuoton kuin perinteiset korkosijoitukset mutta korkeammalla riskitasolla. Näiden obligaatioiden markkinat ovat perinteisesti olleet USA:ssa, mutta rahasto on valuuttakurssisuojattu (euro).",2 stars,2 / 7,8,30,"1,27%",Korko,High Yield,
SEB Climate Focus High Yield Fund C(EUR),EUR,The objective of the Sub-Fund is to deliver an attractive return on your high-yield investments while simultaneously establishing a perdurable positive environmental impact in order to achieve the longterm objectives of the Paris Agreement.,0 stars,2 / 7,9,64,"1,06%",Korko,High Yield,
Aktia Korkosalkku B,EUR,"Rahaston varat sijoitetaan korkomarkkinoille, pääsääntöisesti sijoitusrahastojen ja yhteissijoitusyritysten osuuksiin. Rahaston sijoituskohteiden neutraalipainot ovat: valtionlainat 15 %,hintaindeksien kehitykseen sidotut valtionlainat 5 %, yrityslainat 30 %, matalamman luottoluokituksen high yield-lainat 20 % ja kehittyvien markkinoiden valtionlainat 30 %.",5 stars,2 / 7,8,344,"1,39%",Korko,Yhdistelmä,
BGF Sustainable Global Dynamic Eq A2,USD,"Global Dynamic Equity Fund -rahasto pyrkii maksimoimaan kokonaistuoton. Rahasto sijoittaa maailmanlaajuisesti vähintään 70 prosenttia kokonaisvarallisuudestaan osakkeisiin ilman maa- tai aluerajoituksia. Rahasto pyrkii yleensä sijoittamaan osakkeisiin, jotka ovat sijoitusneuvojan mielestä aliarvostettuja. Rahasto voi myös sijoittaa pienten tai kasvavien yhtiöiden osakkeisiin. Valuuttariskiä hallitaan joustavasti.",3 stars,4 / 7,8,150,"1,79%",Maantiede,Maailma,
SEB Mixed 50 C (EUR),EUR,"Tämä aktiivisesti hallinnoitu rahasto pyrkii kasvattamaan rahastosijoituksen arvoa ajan myötä ja ylittämään vertailuindeksin tuoton. Rahastonhoitaja tekee aktiivisia sijoituspäätöksiä vallitsevien markkinanäkymien analyysin ja huolellisten valintojen pohjalta. Rahasto sijoittaa suoraan tai epäsuorasti osakkeisiin, velkaarvopapereihin ja rahamarkkinainstrumentteihin. Rahaston tavoitteena on sijoittaa 50 % globaaleihin osakkeisiin ja osakesidonnaisiin arvopapereihin, mukaan lukien kehittyvien markkinoiden osakkeet. Rahaston nettoaltistus osakkeisiin voi kuitenkin vaihdella markkinatekijöistä riippuen eri aikoina 20-80 % välillä.",4 stars,3 / 7,8,313,"1,17%",Yhdistelmä,Maltillinen,
Evli Pohjoismaat B,EUR,"Sijoitusrahasto Evli Pohjoismaat on osakerahasto, joka sijoittaa varansa pääasiassa pohjoismaisiin osakkeisiin. Rahaston sijoitusstrategia painottaa yhtiöitä, joilla on vakaa kassavirta ja jotka ovat siihen suhteutettuna vähävelkaisia ja edullisesti hinnoiteltuja. Rahastolla ei ole indeksi-, toimiala- tai maarajoitteita Pohjoismaiden sisällä.",2 stars,4 / 7,8,368,"1,61%",Maantiede,Kehittyneet maat – small/mid ja keskisuuret,Pohjoismaat
Fidelity Glb MA Gr & Inc A-Acc-EUR,EUR,"The fund aims to achieve capital growth over the medium to long term and provide income. The fund invests in a range of asset classes including corporate and government debt securities, equities, real estate, infrastructure and commodities, from anywhere in the world, including emerging markets.",2 stars,3 / 7,8,13,"1,76%",Yhdistelmä,Maltillinen,
Jupiter Merian NA Eq (IRL) L $ Acc,USD,The objective of the fund is to seek to achieve long term capital growth through the active management of a diversified portfolio invested primarily in North American stock markets. It is not proposed to concentrate investments in any one industry or sector.,3 stars,4 / 7,8,28,"1,71%",Maantiede,Kehittyneet maat – suuret yhtiöt,Yhdysvallat suuret sekatyyli
BGF Global Allocation A2,USD,"Rahasto pyrkii maksimoimaan Yhdysvaltain dollareissa esitetyn sijoituksien kokonaistuoton sijoittamalla hallitusti pienellä riskillä osakkeisiin, velkakirjoihin ja lyhytaikaisiin arvopapereihin. Vaikka Rahaston varojen sijoittamisella ei ole määrättyjä maantietellisiä rajoja, se sijoittaa normaaleissa markkinaolosuhteissa ensisijaisesti Yhdysvalloissa, Kanadassa, Länsi-Euroopassa ja Kaukoidässä sijaitsevien tai toimivien valtiollisten tai yksityisten yhtiöiden liikkeeseenlaskijoiden arvopapereihin.",4 stars,3 / 7,6,157,"1,77%",Yhdistelmä,Maltillinen,
Mirae Asset ESG Emerg Asia ex-CHN EqAUSD,USD,"The primary objective of the Fund is to achieve long term growth in the share price through capital appreciation, measured in US Dollars, of the underlying equity portfolio which promotes environmental, social and governance (ESG) criteria. The Principal Investment Manager will seek to achieve the objective of the Sub-Fund by investing mainly in equities and equity related securities of companies domiciled in or exercising a large portion of their economic activity in emerging markets in Asia (including but not limited to, territories and special administrative regions) such as India, Indonesia, Korea, Malaysia, Philippines, Taiwan, Thailand excluding China.",2 stars,4 / 7,8,8,"2,41%",Maantiede,Aasia ei-Japani / Aasia-Tyynimeri,Aasia-Tyynimeri ei-Japani
Fidelity Switzerland A-Dis-CHF,CHF,"Fidelity Switzerland Fund on osakerahasto, joka sijoittaa pääasiallisesti sveitsiläisiin sekä suurten että pienten ja keskisuurten yrityksien osakkeisiin.",1 star,4 / 7,8,197,"1,93%",Maantiede,Kehittyneet maat – suuret yhtiöt,Sveitsi
Jupiter Dynamic Bond L EUR Acc,EUR,"The fund seeks to achieve a high income with the prospect of capital growth from a portfolio of investments in global fixed interest securities. The Fund will invest at least 70% of its Net Asset Value in higher yielding debt securities, either directly or indirectly through derivative instruments.",2 stars,3 / 7,6,34,"1,46%",Korko,Joustava,
Lannebo Småbolag D,EUR,"The fund is an actively managed fund with an emphasis on small-and medium-sized companies in the Nordic countries, mainly Sweden. Stock selection is based on a long-term fundamental analysis of companies in all industries combined with the movement in the portfolio. The criterion for a company's size is its market capitalization, which at the time of investment may not exceed one percent of the total market capitalization.",3 stars,5 / 7,8,52,"1,63%",Maantiede,Kehittyneet maat – small/mid ja keskisuuret,Ruotsi small/mid
