Nimi,Valuutta,Tietoa,Rating,Riski,Vastuullisuus (SFDR),Omistajia Nordnetissä,Kulut,Kategoria,Yläluokka,Alakategoria
Franklin Gold & Prec Mtls A(acc)USD,USD,"Rahasto sijoittaa pääasiassa julkisesti noteerattuihin osakkeisiin ja osakesidonnaisiin arvopapereihin kaikkialla maailmassa. Rahasto sijoittaa kasvuosakkeisiin, mukaan lukien osakkeiksi vaihdettavat arvopaperit ja optiotodistukset, sekä kehittyneillä että kehittyvillä markkinoilla ja seuraavien alueiden ja maiden pörsseissä noteerattujen yritysten osakkeisiin: Pohjois-Amerikka; Manner- Eurooppa: Itävalta, Belgia, Tanska, Suomi, Ranska, Saksa, Italia, Alankomaat, Norja, Espanja, Ruotsi ja Sveitsi; Yhdistynyt Kuningaskunta ja Irlanti; Aasia: Hongkong, Japani, Malesia, Singapore; Australia.",3 stars,6 / 7,6,9592,"1,86%",Sektori,Arvometallit,
AuAg Silver Bullet B,EUR,The focus is on Global Precious Metal Mining Company with a special focus on transferable securities whose value development is affected by the market development for Silver.,2 stars,6 / 7,8,9807,"1,40%",Sektori,Arvometallit,
Evli Silver and Gold B,EUR,"Rahasto sijoittaa varansa sellaisten yritysten julkisen kaupankäynnin kohteena oleviin osakkeisin, joiden liiketoiminnasta merkittävä osa koostuu kullan, hopean, platinaryhmän metallien tai timanttien kaivannais- tai jalostustoiminnasta. Tällaiset osakkeet ovat tyypillisesti julkisen kaupankäynnin kohteena Yhdysvalloissa, Kanadassa, Isossa-Britanniassa tai Australiassa. Rahaston sääntöjen mukaan vähintään 60% rahaston varoista on sijoitettava osakkeisiin. Normaalissa markkinatilnateessa tyypillisesti yli 90% rahaston varoista on sijoitettuna osakkeisiin.",4 stars,6 / 7,6,1612,"1,02%",Sektori,Arvometallit,
Jupiter Gold & Silver L USD Acc,USD,The investment objective of the fund is to seek to achieve a total return by investing predominantly in listed equities.,3 stars,6 / 7,6,3095,"1,75%",Sektori,Arvometallit,
BGF World Gold A2,EUR,"Rahasto sijoittaa pääasiassa kultakaivosyrityksiin, mutta myös osakkeisiin muilla kaivosaloilla.",3 stars,6 / 7,6,5847,"2,09%",Sektori,Arvometallit,
BGF World Gold A2,USD,"Rahasto sijoittaa pääasiassa kultakaivosyrityksiin, mutta myös osakkeisiin muilla kaivosaloilla.",3 stars,6 / 7,6,486,"2,09%",Sektori,Arvometallit,
JPM Korea Equity A (acc) USD,USD,To provide long-term capital growth by investing primarily in a concentrated portfolio of Korean companies.,5 stars,5 / 7,6,1015,"1,80%",Maantiede,Kehittyneet maat – suuret yhtiöt,Korea
Finserve Global Security Fund I SEK R,SEK,"The Sub-Fund’s investment objective is to achieve appropriate income and the highest possible longterm value increase by investing within: - Defense, aerospace and security sector (including homeland and cyber security); - Technology, commodity, infrastructure sectors necessary for society resilience, self-sufficiency, resource independence and for energy transition, digitalisation and electrification. The Sub-Fund will invest mainly in securities of companies without geographical restrictions with the exception of defense companies in Russia and China and in accordance with the principle of risk diversification. No guarantee can be given that the Sub-Fund’s objective will be reached.",5 stars,4 / 7,8,19504,"1,94%",Sektori,Teollisuusmateriaalit,
Carmignac Pf Tech Solutions A EUR Acc,EUR,The Sub-fund’s objective is to outperform the Reference indicator over a recommended minimum investment horizon of 5 years. The Sub-Fund seeks to invest sustainably for long-term growth and implements a socially responsible investment approach.,0 stars,5 / 7,9,468,"1,80%",Sektori,Teknologia,
MetaSpace Fund A,SEK,"Fonden är en aktivt förvaltad aktiefond som gör globala placeringar i aktier och i aktierelaterade överlåtbara värdepapper utgivna av bolag vars verksamhet, produkter och/eller tjänster kännetecknas av ett högt teknikinnehåll. Sådan verksamhet kan till exempel utgöras av: Augmented Reality, Virtual Reality och Mixed Reality, Rymdteknologi, Gaming och eSport, samt Artificiell intelligens. Målsättningen är att Fonden över en rullande femårsperiod ska överträffa sitt jämförelseindex.",3 stars,5 / 7,8,2391,"1,50%",Sektori,Teknologia,
Fidelity Iberia A-Dis-EUR,EUR,"Fidelity Iberia Fund on osakerahasto, joka sijoittaa pääasiallisesti espanjalaisiin ja portugalilaisiin osakkeisiin.",3 stars,4 / 7,8,575,"1,94%",Maantiede,Kehittyneet maat – suuret yhtiöt,Espanja
Fidelity Italy A-Dis-EUR,EUR,"Fidelity Italy Fund on osakerahasto, joka sijoittaa pääasiallisesti italialaisiin osakkeisiin.",3 stars,4 / 7,8,523,"1,93%",Maantiede,Kehittyneet maat – suuret yhtiöt,Italia
Evli Hannibal B2,EUR,-,4 stars,4 / 7,8,171,"1,80%",Maantiede,Kehittyneet maat – small/mid ja keskisuuret,Eurooppa pienyhtiöt
AuAg Essential Metals B,EUR,"The fund aims to, over a five-year period, outperform its benchmark. The fund's benchmark index is MSCI ACWI Metals and Mining Net Total Return Index (M1WD0MM) in Swedish kronor.",0 stars,5 / 7,8,795,"1,40%",Sektori,Luonnonvarat,
Swedbank Robur Global Emerging Markets A,SEK,"Global Emerging Markets is an actively managed equity fund that mainly invests in companies across a range of sectors in emerging markets worldwide, and where up to 20 percent may also be invested in companies in frontier market countries. The fund has a long-term investment horizon and an active investment strategy focused on a selection of companies, where sector, regional and thematic analyses are also key features of the strategy. The fund complies with Swedbank Robur’s Responsible Investment Policy. Read more about the policy in the fund’s Information Brochure and swedbankrobur.se. Sustainability and climate work is an integrated part in our investment strategy. The fund is suitable for those who want exposure to innovative companies in emerging markets.",4 stars,4 / 7,8,2954,"1,45%",Maantiede,Kehittyvät maat,Kehittyvät maat
Invesco Commodity Allocation A Acc,USD,"Rahaston tavoitteena on pitkän aikavälin pääomankasvu. Rahasto sijoittaa ensisijaisesti sellaisten yritysten osakkeisiin, joiden toiminta liittyy kullan ja muiden jalometallien etsimiseen, kaivamiseen tai jalostukseen tai kaupankäyntiin kyseisillä metalleilla tai niihin sijoittamiseen.Rahasto ei sijoita suoraan kultaan ja muihin jalometalleihin. Rahasto sijoittaa maailmanlaajuisesti. Rahastoa hallinnoidaan aktiivisesti sen tavoitteiden puitteissa eikä sitä ole sidottu vertailuindeksiin.",0 stars,6 / 7,6,927,"1,79%",Sektori,Raaka-aineet laaja,
East Capital New Europe A1 SEK,SEK,"The investment objective of the New Europe Sub-Fund is to provide long-term capital growth through exposure to companies in the Central & Eastern European region excluding Russia. The Sub-Fund will mainly invest in companies located in countries that have joined the European Union since 2004 and that may join in the future, but also in companies of other emerging and frontier markets of Central & Eastern Europe. The Sub-Fund will invest at least 50% of its net assets in securities of issuers domiciled in Albania, Armenia, Austria, Belarus, Bosnia-Herzegovina, Bulgaria, Croatia, Cyprus, the Czech Republic, Estonia, Georgia, Greece, Hungary, Kazakhstan, Latvia, Lithuania, Macedonia, Moldova, Montenegro, Poland, Romania, Serbia, Slovakia, Slovenia, Turkey and Ukraine. The Sub-Fund may also invest in securities of issuers not domiciled in the aforementioned countries but which exercise a significant part of their economic activity there.",3 stars,4 / 7,8,1986,"2,20%",Maantiede,Euroalue ja Eurooppa erityisryhmät,Kehittyvä Eurooppa ei-Venäjä
Jupiter Financial Innovt L USD Acc,USD,"The investment objective of the fund is to achieve capital growth in the long-term. The Fund will invest at least 70% of its Net Asset Value in a global portfolio consisting of: (i) equity and equity related securities (including preference shares, warrants, participation notices and depositary receipts) which may be issued by issuers located in any country (including Emerging Markets) and which the Investment Manager believes drive or benefit from (or have the potential to drive or benefit from) financial innovation, including but not limited to payments technology, digital financial services, mobile banking and blockchain.",3 stars,5 / 7,6,652,"1,73%",Sektori,Rahoituspalvelut,
Handelsbanken Kestävä Energia (A1 EUR),EUR,"Rahasto on aktiivisesti hoidettu osakerahasto, jonka tavoitteena on pitkällä aikavälillä saavuttaa korkea tuotto. Rahasto sijoittaa maailmanlaajuisesti sellaisten yritysten osakkeisiin, jotka kehittävät tai käyttävät teknologiaa tai metodeja, jotka rajoittavat globaalia ilmaston lämpenemistä, joko suorasti tai epäsuorasti, rajoittamalla hiilidioksiidipäästöjä ja muita kasvihuonekaasuja.",3 stars,5 / 7,9,10543,"1,51%",Sektori,Uusiutuva energia,
East Capital Balkans A1 SEK,SEK,The investment objective of the Sub-Fund is to provide long-term capital growth through exposure to companies in the Balkan region.,3 stars,4 / 7,8,2215,"2,30%",Maantiede,Euroalue ja Eurooppa erityisryhmät,Kehittyvä Eurooppa ei-Venäjä
MS INVF Global Insight A,USD,"The Fund’s investment objective is to seek long-term capital appreciation (measured in USD). The fund primarily invests (at least 70% of total net assets) in securities issued by companies on a global basis. Under normal market conditions, the fund's investment objective will be pursued by investing primarily in equities of established and emerging companies. The investment process will emphasise a bottom-up stock selection process, seeking attractive investments on an individual company basis. In selecting securities for investment, the investment manager typically invests in unique companies it believes have and sustainable competitive advantages with above average business visibility, the ability to deploy capital at high rates of return, strong balance sheets and an attractive risk/reward.",2 stars,6 / 7,8,2605,"1,84%",Tyyli,kasvuosakkeet,
DNB Fund Technology A EUR Acc,EUR,"The Sub-Fund seeks to invest mainly in equities of companies operating in or associated with the technology, media and telecom sectors, with the aim to achieve a positive relative return over the long-term. Geographically the Sub-Fund has full flexibility.",4 stars,4 / 7,8,904,"1,56%",Sektori,Teknologia,
Handelsbanken Latin Amerikka (A1 EUR),EUR,"Rahasto on aktiivisesti hoidettu osakerahasto, jonka tavoitteena on pitkällä aikavälillä saavuttaa tuotto, joka vastaa vähintään niiden markkinoiden keskimääräistä tuottoa, joille rahasto voi sijoittaa. Rahasto sijoittaa Latinalaisessa Amerikassa ja Keski-Amerikassa toimivien yritysten liikkeellelaskemiin osakkeisiin. Rahasto voi myös sijoittaa EU:n, EFTA:n, Australian, Hongkongin, Japanin, Kanadan, Singaporen ja USA:n alueella toimiviin yrityksiin, jos Latinalaisen Amerikan osuus niiden liiketoiminnasta tai markkinoista on vähintään 25 prosenttia.",3 stars,5 / 7,9,590,"1,60%",Maantiede,Kehittyvät maat,Latinalainen Amerikka
Templeton Emerging Markets A(acc)USD,USD,"Rahasto sijoittaa ensisijaisesti osakesidonnaisiin arvopapereihin ja myös velkasitoumuksiin, joiden liikkeeseenlaskijoita ovat kehittyvissä maissa tai kehitysmaissa perustetut tai niissä pääasiassa toimivat yritykset tai kyseisten maiden hallitukset. Rahasto voi sijoittaa myös yhtiöihin, joiden tuotoista tai voitoista huomattava osa kertyy kehittyvistä talouksista tai joiden liikeomaisuudesta huomattava osa sijaitsee kehittyvissä talouksissa. Rahasto voi myös sijoittaa sellaisiin liikkeeseenlaskijoiden osakesidonnaisiin arvopapereihin tai velkainstrumentteihin, jotka ovat sidoksissa kehittyvien maiden varallisuuteen tai valuuttoihin.",4 stars,4 / 7,8,137,"1,97%",Maantiede,Kehittyvät maat,Kehittyvät maat
Schroder ISF Emerging Europe A Acc EUR,EUR,"To achieve long-term capital growth through investment in equity related and debt securities benefiting from the economic growth of Central and Eastern Europe including markets of the former Soviet Union and the Mediterranean Emerging Markets. The portfolio will, to a limited extent, seek exposure to the markets of North Africa and the Middle East.",0 stars,6 / 7,8,325,"1,94%",Muut,,
Nordnet Suomi Indeksi,EUR,"Rahasto on Suomen markkinoille sijoittava osakeindeksirahasto, ja rahaston tavoitteena on jäljitellä OMX Helsinki 25 ESG Responsible Gross -indeksiä, joka sisältää vain tietyt kestävän kehityksen kriteerit täyttävät yritykset.",5 stars,4 / 7,8,295001,"0,00%",Maantiede,Kehittyneet maat – small/mid ja keskisuuret,Suomi
Allianz Global Metals and Mining A EUR,EUR,"Long-term capital growth by investing in global equity markets with a focus on natural resources. Natural resources may comprise of nonferrous metals, iron and other ores, steel, coal, precious metals, diamonds or industrial salts and minerals.",3 stars,5 / 7,6,734,"1,85%",Sektori,Luonnonvarat,
Templeton Latin America A(acc)USD,USD,"Rahasto sijoittaa ensisijaisesti osakesidonnaisiin arvopapereihin, joiden liikkeeseenlaskijoita ovat Latinalaisen Amerikan alueella perustetut tai niissä pääasiassa toimivat liikkeeseenlaskijat. Loput rahaston varat voidaan sijoittaa myös muiden kuin edellä mainitun alueen yritysten ja valtion yhteisöjen osakesidonnaisiin arvopapereihin ja velkasitoumuksiin.",3 stars,5 / 7,6,317,"2,24%",Maantiede,Kehittyvät maat,Latinalainen Amerikka
Swedbank Robur Emerging Europe A,SEK,"Emerging Europe is an actively managed equity fund that mainly invests in companies across a range of sectors in European emerging markets (excluding Russia, Belarus). Up to 20 percent of the fund's assets can also be invested in companies from other countries that at the time of investment have at least 30 percent of their assets, production, profits or turnover in the mentioned market. The fund focuses on a selection of companies, where sector, regional and thematic analyses are also key features of the strategy. Investments are made in companies that, among others, are active in communications, sustainable energy, IT, finance and healthcare. The fund complies with Swedbank Robur’s Responsible Investment Policy. Read more about policy and share classes in the fund’s Information Brochure and swedbankrobur.se. Sustainability and climate work is an integrated part in our investment strategy.",0 stars,5 / 7,8,1378,"1,44%",Maantiede,Euroalue ja Eurooppa erityisryhmät,Kehittyvä Eurooppa ei-Venäjä
Storebrand Renewable Energy A3,EUR,"Storebrand Fornybar Energi is a fossil-free equity fund that aims to achieve long term excess return by investing in a limited portion of the global stock market. The fund invests in sustainable companies that contributes to resolve the world's climate challenges, and has its primary business within solar power, wind power, hydrogen, geothermal energy, hydropower and the infrastructure needed to deploy and distribute renewable energy. The fund may also be invested in companies that contribute to reduced energy consumption. The fund invests in companies with different types of technology, services and solutions, and broadly within different parts of value chains, but will still be associated with greater risk than broad global equity funds. The fund's return may deviate significantly from the benchmark, as a result of the fund's investments being mainly directed at a limited part of the investment universe of the benchmark.",1 star,5 / 7,9,180,"1,05%",Sektori,Uusiutuva energia,
Templeton Eastern Europe A(acc)EUR,EUR,"Rahasto sijoittaa ensisijaisesti Itä-Euroopan maiden ja uusien itsenäisten valtioiden (”alue”) lakien mukaan perustettujen tai pääasiassa niissä toimivien julkisen kaupankäynnin kohteena olevien yhtiöiden noteerattuihin osakesidonnaisiin arvopapereihin. Rahasto voi myös sijoittaa edellä mainittujen valtioiden hallitusten liikkeeseen laskemiin arvopapereihin ja alueella sijaitsevien tai siellä pääasiassa toimintaa harjoittavien yhtiöiden yksityistämistodistuksiin. Rahasto sijoittaa ensisijaisesti yhtiöihin (i), joiden arvopapereiden ensisijainen kauppapaikka on alueella, mikäli ne ovat noteerattuja; tai (ii) joiden tuotoista tai voitoista vähintään 50 % kertyy alueella valmistetuista tai myydyistä tuotteista, alueelle tehdyistä sijoituksista tai siellä suoritetuista palveluista tai joiden liikeomaisuudesta vähintään 50 % sijaitsee alueella.",0 stars,5 / 7,6,372,"2,45%",Muut,,
JPM Euroland Equity A (dist) EUR,EUR,"Rahasto sijoittaa varansa osakkeisiin, jotka noteerataan nykyisellä tai tulevalla euroalueella.",4 stars,4 / 7,8,209,"1,73%",Maantiede,Kehittyneet maat – suuret yhtiöt,Euroalue suuret yhtiöt
Fidelity Latin America A-Dis-USD,USD,"Fidelity Latin America Fund on osakerahasto, joka sijoittaa latinalaisen Amerikkan maihin kuten Meksikoon, Argentiinaan, Brasiliaan ja Chileen. Lisäki rahasto sijoittaa Keski- ja Etelä-Amerikassa myös kehitysmaihin kuten Venezuelaan, Kolumbiaan ja Peruun.",3 stars,5 / 7,6,313,"1,95%",Maantiede,Kehittyvät maat,Latinalainen Amerikka
BGF World Mining A2,USD,"Rahaston tavoitteena on maksimoida sijoituksellesi saatava tuotto Rahaston pääoman kasvun ja tuoton yhdistelmällä. Rahasto sijoittaa maailmanlaajuisesti vähintään 70 % kokonaisvaroistaan sellaisten yritysten osakesidonnaisiin arvopapereihin (esim. osakkeisiin), joiden pääasiallinen liiketoiminta on perus- ja jalometallien ja/tai mineraalien kaivuu ja/tai tuotanto. Rahasto ei omista fyysistä kultaa tai metalleja. Salkunhoitaja voi käyttää rahoitusjohdannaisia (eli sijoituksia, joiden hinta perustuu yhteen tai useampaan kohde-etuuteen) apuna rahaston sijoitustavoitteen saavuttamisessa ja/tai vähentääkseen rahaston salkun riskiä ja sijoituskustannuksia sekä saadakseen aikaan lisää tuottoa. Rahasto voi johdannaisten kautta hyödyntää eritasoista vipuvaikutusta (eli Rahasto hankkii markkinoilta sijoituksia, joiden arvo ylittää sen varat).",4 stars,5 / 7,6,889,"2,06%",Sektori,Luonnonvarat,
Templeton Japan A(acc)JPY,JPY,"Rahasto sijoittaa ensisijaisesti sellaisten liikkeeseenlaskijoiden osakesidonnaisiin arvopapereihin, joiden toimipaikka tai pääasiallinen liiketoiminta on ensisijaisesti Japanissa. Rahasto voi myös etsiä sijoitusmahdollisuuksia muuntyyppisistä arvopapereista, joita ovat muun muassa etuoikeutetut osakkeet, kantaosakkeisiin vaihdettavat arvopaperit samoin kuin valtioiden ja yritysten liikkeeseen laskemat jenimääräiset tai muun valuutan määräiset velkasitoumukset.",3 stars,4 / 7,8,199,"1,84%",Maantiede,Kehittyneet maat – suuret yhtiöt,Japani suuret yhdistelmäosakkeet
BGF World Mining A2,EUR,"Rahaston tavoitteena on maksimoida sijoituksellesi saatava tuotto Rahaston pääoman kasvun ja tuoton yhdistelmällä. Rahasto sijoittaa maailmanlaajuisesti vähintään 70 % kokonaisvaroistaan sellaisten yritysten osakesidonnaisiin arvopapereihin (esim. osakkeisiin), joiden pääasiallinen liiketoiminta on perus- ja jalometallien ja/tai mineraalien kaivuu ja/tai tuotanto. Rahasto ei omista fyysistä kultaa tai metalleja. Salkunhoitaja voi käyttää rahoitusjohdannaisia (eli sijoituksia, joiden hinta perustuu yhteen tai useampaan kohde-etuuteen) apuna rahaston sijoitustavoitteen saavuttamisessa ja/tai vähentääkseen rahaston salkun riskiä ja sijoituskustannuksia sekä saadakseen aikaan lisää tuottoa. Rahasto voi johdannaisten kautta hyödyntää eritasoista vipuvaikutusta (eli Rahasto hankkii markkinoilta sijoituksia, joiden arvo ylittää sen varat).",4 stars,5 / 7,6,73,"2,06%",Sektori,Luonnonvarat,
BGF Emerging Markets Eq Inc A2,USD,"The Fund seeks an above average income from its equity investments without sacrificing long term capital growth. The Fund invests globally at least 70% of its total assets in the equity securities of companies domiciled in, or exercising the predominant part of their economic activity in, emerging markets. Investment may also be made in the equity securities of companies domiciled in, or exercising the predominant part of their economic activity in, developed markets that have significant business operations in emerging markets.",4 stars,4 / 7,6,115,"1,88%",Maantiede,Kehittyvät maat,Kehittyvät maat
SEB Finland Optimized Exposure C (EUR),EUR,"SEB Finland Optimized Exposure Fund -rahaston tavoite on saavuttaa tuoton, joka seuraa mahdollisimman tarkasti sen vertailuindeksiä, OMX Helsinki Benchmark Cap -indeksiä. Rahasto sijoittaa pääasiassa sellaisten Suomen markkinoilla toimivien yritysten osakkeisiin ja osakkeisiin liittyviin siirtokelpoisiin arvopapereihin, jotka sisältyvät rahaston vertailuindeksiin.",3 stars,4 / 7,8,518,"0,71%",Maantiede,Kehittyneet maat – small/mid ja keskisuuret,Suomi
JPM Europe Equity Plus A perf (acc) EUR,EUR,"To provide long term capital growth through exposure to European companies, by direct investments in securities of such companies and through the use of derivatives.",5 stars,4 / 7,8,523,"1,73%",Maantiede,Kehittyneet maat – suuret yhtiöt,Eurooppa suuret yhtiöt sekatyyli
UBS (Lux) ES Glb EM Markts Opp(USD) Pacc,USD,"The Sub-Fund aims to generate capital appreciation with a reasonable level of income, while giving due consideration to risk diversification and the liquidity of the Sub-Fund’s assets. The Sub-Fund seeks to invest in equities that are expected to benefit most from emerging market growth.",2 stars,4 / 7,8,64,"2,00%",Maantiede,Kehittyvät maat,Kehittyvät maat
JPM Latin America Equity A (dist) USD,USD,"Rahasto sijoittaa varansa pääasiassa sellaisten yritysten osakkeisiin, jotka sijaitsevat tai joilla on merkittäviä sijoituksia latinalaisessa Amerikassa.",4 stars,5 / 7,6,436,"1,80%",Maantiede,Kehittyvät maat,Latinalainen Amerikka
JPM Latin America Equity A (acc) USD,USD,"Rahasto sijoittaa varansa pääasiassa sellaisten yritysten osakkeisiin, jotka sijaitsevat tai joilla on merkittäviä sijoituksia latinalaisessa Amerikassa.",4 stars,5 / 7,6,165,"1,80%",Maantiede,Kehittyvät maat,Latinalainen Amerikka
Luxembourg Selection Active Solar C USD,USD,"The investment objective of the Subfund is long-term capital appreciation through investing at least two thirds of the assets in shares of companies whose primary activity is associated with the solar industry. The Subfund has sustainable investment as its objective and accordingly complies with Article 9 of Regulation (EU) 2019/2088 on sustainability-related disclosures in the financial services sector (“SFDR”). Information related to the Subfund’s sustainable investment objective is available in Annex 1 to this document (SFDR RTS Art. 18(2)). The approach adopted by the Subfund is that solar energy is one of the least polluting sources of energy. When power is generated by a solar installation, it reduces the carbon emissions, because electric power is not generated by a more polluting source of electricity.",1 star,6 / 7,9,1170,"2,20%",Sektori,Uusiutuva energia,
Fidelity Germany A-Dis-EUR,EUR,"Fidelity Germany Fund on osakerahasto, joka sijoittaa pääasiallisesti Saksassa noteerattujen yritysten osakkeisiin.",4 stars,4 / 7,8,2501,"1,92%",Maantiede,Kehittyneet maat – suuret yhtiöt,Saksa
SEB Swedish Value Fund,SEK,-,5 stars,4 / 7,8,912,"1,50%",Maantiede,Kehittyneet maat – small/mid ja keskisuuret,Ruotsi
SEB Swedish Value Fund utd,SEK,-,5 stars,4 / 7,8,67,"1,50%",Maantiede,Kehittyneet maat – small/mid ja keskisuuret,Ruotsi
Fidelity Pacific A-Dis-USD,USD,"Fidelity Pacific Fund on osakerahasto, joka sijoittaa pääasiallisesti Tyynenmeren alueen maihin.",3 stars,4 / 7,8,319,"1,94%",Maantiede,Aasia ei-Japani / Aasia-Tyynimeri,Aasia-Tyynimeri
PineBridge Latin America Equity A,USD,The Sub-Fund seeks to achieve a superior rate of return by making equity and equity-related investments in companies operating in the economies of Latin America.,3 stars,5 / 7,8,33,"2,13%",Maantiede,Kehittyvät maat,Latinalainen Amerikka
Evli Suomi Select B,EUR,"Sijoitusrahasto Evli Suomi Select on kotimainen osakerahasto. Sijoituskohteiden valinnassa keskeinen valintaperuste on osakkeen arvostus suhteessa kasvuun. Pääpaino on kohtuullisesti hinnoitelluissa yhtiöissä, joiden tuloksen ja tulevien kassavirtojen kasvu on yli keskimääräisen sekä yhtiöissä, jotka ovat vertailuryhmäänsä nähden aliarvostettuja ja joiden arvostuskertoimilla on nousumahdollisuuksia. Tämä tavoite voidaan saavuttaa aktiivisella salkunhoidolla sekä kattavalla fundamentaalianalyysilla, jota täydennetään kvantitatiivisella analyysilla. Rahaston toimialapainotukset pohjautuvat toimialojen suhdannekuvaan sekä suhteelliseen arvostukseen. Salkun koostumusta vaihdellaan markkinatilanteiden mukaan.",4 stars,4 / 7,8,1122,"1,85%",Maantiede,Kehittyneet maat – small/mid ja keskisuuret,Suomi
Fidelity Japan Value A-Acc-JPY,JPY,"The fund aims to achieve capital growth over time. The fund invests at least 70% (and normally 75%) of its assets, in equities of Japanese companies listed on the Japanese stock exchange with the focus on companies that Fidelity considers to be undervalued. The fund may also invest in money market instruments on an ancillary basis.",5 stars,4 / 7,8,408,"1,92%",Maantiede,Kehittyneet maat – suuret yhtiöt,Japani suuret yhdistelmäosakkeet
Danske Invest Europe Hgh Dvd A,EUR,"Rahasto tavoittelee markkinoiden yleisen kehityksen ylittävää tuottoa. Osuuslajin osuudet ovat kasvuosuuksia. Rahasto sijoittaa pääosin eurooppalaisiin osakkeisiin, joiden liikkeeseenlaskijoina toimivien yhtiöiden tuotteet tai palvelut ovat saavuttaneet vakiintuneen aseman ja joiden odotetaan maksavan korkeaa osinkoa. Pienen osan varoistaan rahasto voi sijoittaa itäeurooppalaisiin tai Itä-Euroopan reuna-alueiden osakkeisiin. Rahasto voi sijoittaa maihin, jotka luokitellaan kehittyviksi markkinoiksi.",4 stars,4 / 7,8,3113,"1,87%",Tyyli,osinko-osakkeet,
